2026-03-11,-,Engineers Geoscientists Manitoba,Engineers Geoscientists Manitoba,Michael Gregoire,-,-,-,891012,In-House,"Duque, Juan",In-House,Active,"LOBBYING DESCRIPTION: 
ORGANIZATION DESCRIPTION: Corporation. Non-profit. Professional regulatory body
BUSINESS SUMMARY: Regulate the professions of engineering and geoscience
GOVERNMENT FUNDING: "
2026-03-09,-,Canadian Beverage Container Recycling Association (CBCRA),Canadian Beverage Container Recycling Association (CBCRA),"Gardner, Matthew",-,-,-,888379,Consultant,"Gardner, Matthew",Consultant,Active,"LOBBYIST: Gardner, Matthew | CLIENT: Canadian Beverage Container Recycling Association (CBCRA) | FIRM:  | STATUS: Active"
2026-03-09,-,GT & Company Executive Advisors,Teranet Holdings LP,"Holoiday, Leah",-,-,-,890214,Consultant,"Holoiday, Leah",Consultant,Active,"LOBBYIST: Holoiday, Leah | CLIENT: Teranet Holdings LP | FIRM: GT & Company Executive Advisors | STATUS: Active"
2026-03-04,-,Cereals Canada,Cereals Canada,Dean Dias,-,-,-,888442,In-House,"Carlson, Leif, Dias, Dean",In-House,Active,"LOBBYING DESCRIPTION: 
ORGANIZATION DESCRIPTION: Canadian Cereals - wheat, barley and oats
Farmers, Exporters, Life-science companies and processors
BUSINESS SUMMARY: Cereals Canada is the national, not-for-profit, industry association representing the Canadian cereal grains value chain. We value relationships and work with government and stakeholders to provide timely, expert technical information and deliver best-in-class customer experience. We are dedicated to supporting the Canadian cereals value chain including farmers, exporters, developers, processors, and our customers around the world with a focus on trade, science, and sustainability.
GOVERNMENT FUNDING: Agriculture and Agri-Food Canada (AAFC): $1,261,187"
2026-03-04,-,Fujifilm Sonosite Canada Inc.,Fujifilm Sonosite Canada Inc.,Masa Fukumoto,-,-,-,888302,In-House,"Homan, Colleen, Mister, Matthew, Staveley, Carole",In-House,Active,"LOBBYING DESCRIPTION: 
ORGANIZATION DESCRIPTION: Fujifilm Sonosite Canada Inc. is a for-profit corporation with two individuals who act as officers and directors.
BUSINESS SUMMARY: Fujifilm Sonosite Canada Inc. focuses on bedside and point-of-care ultrasound solutions.
GOVERNMENT FUNDING: "
2026-03-03,-,Foresight Strategic Advisors Inc.,Canadian Scholarship Trust Foundation,"Green, Martin",-,-,-,887906,Consultant,"Green, Martin",Consultant,Active,"LOBBYIST: Green, Martin | CLIENT: Canadian Scholarship Trust Foundation | FIRM: Foresight Strategic Advisors Inc. | STATUS: Active"
2026-03-03,-,Counsel Public Affairs Inc,Canadian Beverage Container Recycling Association (CBCRA),"Mackintosh, Gord",-,-,-,888402,Consultant,"Mackintosh, Gord",Consultant,Active,"LOBBYIST: Mackintosh, Gord | CLIENT: Canadian Beverage Container Recycling Association (CBCRA) | FIRM: Counsel Public Affairs Inc | STATUS: Active"
2026-03-03,-,Canadian Beverage Container Recycling Association (CBCRA),Canadian Beverage Container Recycling Association (CBCRA),"Mason, Jodee",-,-,-,879716,Consultant,"Mason, Jodee",Consultant,Active,"LOBBYIST: Mason, Jodee | CLIENT: Canadian Beverage Container Recycling Association (CBCRA) | FIRM:  | STATUS: Active"
2026-02-27,-,Upstream Strategy Group,Abbott Rapid Diagnostics ULC,"Anthony, Jen",-,-,-,879645,Consultant,"Anthony, Jen",Consultant,Active,"LOBBYIST: Anthony, Jen | CLIENT: Abbott Rapid Diagnostics ULC | FIRM: Upstream Strategy Group | STATUS: Active"
2026-02-25,-,Fortinet Technologies (Canada) ULC,Fortinet Technologies (Canada) ULC,Mike Power,-,-,-,879444,In-House,"Power, Mike",In-House,Active,"LOBBYING DESCRIPTION: 
ORGANIZATION DESCRIPTION: Fortinet Technologies (Canada) ULC is a for-profit business.
BUSINESS SUMMARY: Develops and produces of cyber security products and services
GOVERNMENT FUNDING: "
2026-02-24,-,Canadian Fuels Association,Canadian Fuels Association,Robert Larocque,-,-,-,879345,In-House,"Hoffman, Rob, Schick, David",In-House,Active,"LOBBYING DESCRIPTION: 
ORGANIZATION DESCRIPTION: General membership of the association: any person engaged in the
manufacture, sale and distribution of petroleum products in Canada who
consents to be a member of the Association
BUSINESS SUMMARY: Non-profit association representing Canadian companies involved in the
refining, distributing and marketing of transportation products.  Conducts
research to develop industry policy on health, environmental and
business issues.  Activities include: establishing environmental
policies; developing guidelines for the safe handling of petroleum
products; providing information on industry activities to the public;
and developing relationships with government and public interest groups
to address issues of common concern.
GOVERNMENT FUNDING: "
2026-02-24,-,Counsel Public Affairs Inc.,Manitoba Real Estate Association,"Mason, Jodee",-,-,-,704250,Consultant,"Mason, Jodee",Consultant,Active,"LOBBYIST: Mason, Jodee | CLIENT: Manitoba Real Estate Association | FIRM: Counsel Public Affairs Inc. | STATUS: Active"
2026-02-23,-,Medical Technology Association of Canada (Medtech Canada),Medical Technology Association of Canada (Medtech Canada),Nicole DeKort,-,-,-,879239,In-House,"Pankhurst, Rob",In-House,Active,"LOBBYING DESCRIPTION: 
ORGANIZATION DESCRIPTION: Medtech Canada is the national association created by and for the Canadian medical technology industry. We are a non-profit association. Medtech Canada is the primary source for advocacy, information and education on the medical technology industry for members, the greater healthcare community, industry partners and the general public. Our goals are to advance health outcomes for patients in Canada and the growth and vibrancy of the industry in Canada.
BUSINESS SUMMARY: Medtech Canada is the national association created by and for the Canadian medical technology industry. Medtech Canada is the primary source for advocacy, information and education on the medical technology industry for members, the greater healthcare community, industry partners and the general public. Our goals are to advance health outcomes for patients in Canada and the growth and vibrancy of the industry in Canada. We focus on ensuring access to proven, safe technology and new, innovative medical technology developed by our member companies.
GOVERNMENT FUNDING: "
2026-02-23,-,Vision Loss Rehabilitation Canada,Vision Loss Rehabilitation Canada,Jennifer Urosevic,-,-,-,879184,In-House,"Urosevic, Jennifer",In-House,Active,"LOBBYING DESCRIPTION: 
ORGANIZATION DESCRIPTION: VLRC's mission is to provide high quality, integrated and accessible rehabilitation and healthcare services that enable Canadians impacted by vision loss to live the lives they choose.
VLRC is registered not-for-profit organizations.
BUSINESS SUMMARY: Vision Loss Rehabilitation Canada is a health services organization. Vision Loss Rehabilitation Canada provides training that enables people who are blind or partially sighted to develop or restore key daily living skills, helping enhance their independence, safety and mobility. Vision Loss Rehabilitation Canada’s certified specialists work closely with ophthalmologists, optometrists and other health care professionals, providing essential care on a referral basis in homes and communities across Canada.
GOVERNMENT FUNDING: Ministry of Health: $625,240; Ministry of Social Services: $380,145"
2026-02-20,-,Canadian Beverage Container Recycling Association (CBCRA),Canadian Beverage Container Recycling Association (CBCRA),Ken Friesen,-,-,-,879045,In-House,"Friesen, Ken",In-House,Active,"LOBBYING DESCRIPTION: 
ORGANIZATION DESCRIPTION: CBCRA is the beverage container recycling program of Manitoba.
BUSINESS SUMMARY: Canadian Beverage Container Recycling Association (CBCRA)
GOVERNMENT FUNDING: "
2026-02-20,-,Remedy Government Relations,Miller Environmental Corporation,"Obach, Mitch",-,-,-,879073,Consultant,"Obach, Mitch",Consultant,Active,"LOBBYIST: Obach, Mitch | CLIENT: Miller Environmental Corporation | FIRM: Remedy Government Relations | STATUS: Active"
2026-02-19,-,Hort Club Manitoba,Hort Club Manitoba,Benjamin Schofield,-,-,-,878915,In-House,"Schofield, Benjamin",In-House,Active,"LOBBYING DESCRIPTION: 
ORGANIZATION DESCRIPTION: Hort Club is a sole proprietorship operating as a voluntary professional organization. It serves apprentice Landscape Horticulturists in Manitoba through peer mentorship, educational programming, and trade advocacy. Membership is informal and community-based, consisting primarily of current and prospective apprentices in the landscape horticulture trade. The organization operates on a community-reinvestment model, directing all revenue back into programming and apprentice support.
BUSINESS SUMMARY: Hort Club is a peer mentorship organization supporting apprentice Landscape Horticulturists in Manitoba. Our activities include educational programming, tutoring and academic support, apprenticeship readiness training, and advocacy for improved accessibility and equity within the province's apprenticeship pathways.
GOVERNMENT FUNDING: "
2026-02-19,-,Imperial Oil Limited,Imperial Oil Limited,John Whelan,-,-,-,875922,In-House,"Smotra, Andrea",In-House,Active,"LOBBYING DESCRIPTION: 
ORGANIZATION DESCRIPTION: Imperial Oil Ltd. is a publicly-traded corporation. It is traded on the TSX under ""IMO"".
BUSINESS SUMMARY: Imperial Oil Ltd. is an integrated energy company headquartered in Calgary, Alberta. It explores for, produces, refines and markets various petroleum products that are essential to society. It refines products such as gasoline, diesel, heating oil, natural gas, lubricants, and chemicals used to make plastics. It markets products such as fuels, lubricants and asphalts.
GOVERNMENT FUNDING: "
2026-02-11,-,Primerica Financial Services (Canada) Ltd.,Primerica Financial Services (Canada) Ltd.,John Adams,-,-,-,878463,In-House,"Adams, John, Morris, Zachary",In-House,Active,"LOBBYING DESCRIPTION: 
ORGANIZATION DESCRIPTION: Primerica is a life insurance issuer and mutual fund dealer.
BUSINESS SUMMARY: Primerica is a life insurance issuer and mutual funds dealer.
GOVERNMENT FUNDING: "
2026-02-11,-,Golfdale Consulting Ltd.,Primerica Financial Services Ltd.,"Bilhan, Hande",-,-,-,819686,Consultant,"Bilhan, Hande",Consultant,Active,"LOBBYIST: Bilhan, Hande | CLIENT: Primerica Financial Services Ltd. | FIRM: Golfdale Consulting Ltd. | STATUS: Active"
2026-02-09,-,Fasken Martineau DuMoulin LLP,Qikiqtaaluk Horizon Arctic Services Limited Partnership,"Gregoire, Dana",-,-,-,877383,Consultant,"Gregoire, Dana",Consultant,Active,"LOBBYIST: Gregoire, Dana | CLIENT: Qikiqtaaluk Horizon Arctic Services Limited Partnership | FIRM: Fasken Martineau DuMoulin LLP | STATUS: Active"
2026-02-09,-,The Surety Association of Canada,The Surety Association of Canada,"Mackintosh, Gord",-,-,-,878359,Consultant,"Mackintosh, Gord",Consultant,Active,"LOBBYIST: Mackintosh, Gord | CLIENT: The Surety Association of Canada | FIRM:  | STATUS: Active"
2026-02-09,-,Global Public Affairs Inc.,Maplebear Inc. (d/b/a Instacart),"Williamson, Matt",-,-,-,878260,Consultant,"Williamson, Matt",Consultant,Active,"LOBBYIST: Williamson, Matt | CLIENT: Maplebear Inc. (d/b/a Instacart) | FIRM: Global Public Affairs Inc. | STATUS: Active"
2026-02-03,-,Chadwick Consulting Ltd.,Manitoba Association of Landscape Architects,"Darragh, Lori",-,-,-,878083,Consultant,"Darragh, Lori",Consultant,Active,"LOBBYIST: Darragh, Lori | CLIENT: Manitoba Association of Landscape Architects | FIRM: Chadwick Consulting Ltd. | STATUS: Active"
2026-02-02,-,FP Canada,FP Canada,Tashia Batstone,-,-,-,877287,In-House,"Batstone, Tashia, Binkley, Joshua, MacLennan, Craig",In-House,Active,"LOBBYING DESCRIPTION: 
ORGANIZATION DESCRIPTION: FP Canada is a national, not-for-profit professional body; FP Canada is not a membership association. FP Canada fulfills its mandate under the leadership of its Board of Directors, who work on behalf of the Canadian public, FP Canada certificants and other stakeholders to ensure that FP Canada’s purpose is realized. The Board is composed of 11 individuals with varied backgrounds that are relevant to achieving FP Canada’s purpose.
BUSINESS SUMMARY: FP Canada is a national not-for-profit education, certification, and professional oversight organization working in the public interest. FP Canada is dedicated to championing better financial wellness for all Canadians by certifying financial planners and leading the advancement of professional financial planning in Canada. FP Canada achieves its mandate through two distinct divisions. Through the FP Canada Standards Council division, FP Canada establishes financial planning standards and enforces those standards among 19,000 FP Canada certificants - Certified Financial Planner professionals and Qualified Associate Financial Planner professionals. Through the FP Canada Institute division, which is dedicated to elevating the practice of financial planning, FP Canada provides professional education, tools, and resources to help financial planners meet the needs of Canadians.
GOVERNMENT FUNDING: "
2026-02-02,-,Big Picture Public Affairs,Spirits Canada,"Shelton, Tracey Leigh",-,-,-,877954,Consultant,"Shelton, Tracey Leigh",Consultant,Active,"LOBBYIST: Shelton, Tracey Leigh | CLIENT: Spirits Canada | FIRM: Big Picture Public Affairs | STATUS: Active"
2026-01-30,-,Canadian Pacific Railway Company,Canadian Pacific Railway Company,Keith Creel,-,-,-,877038,In-House,"Cato, Nathan, Clements, James, Hucker, Elizabeth, Mason, Kevin",In-House,Active,"LOBBYING DESCRIPTION: 
ORGANIZATION DESCRIPTION: Canadian Pacific Kansas City Limited (TSX: CP.TO) is a single-line rail network connecting Canada, the U.S. and Mexico. Canadian Pacific Railway Company is a subsidiary of Canadian Pacific Kansas City Limited. It is headquartered in Calgary, Alberta.
BUSINESS SUMMARY: Canadian Pacific Kansas City Limited (TSX: CP.TO) is a single-line rail network connecting Canada, the U.S. and Mexico. Canadian Pacific Railway Company is a subsidiary of Canadian Pacific Kansas City Limited. It is headquartered in Calgary, Alberta.
GOVERNMENT FUNDING: Emissions Reduction Alberta - Hydrogen Rail Initiative: $2,275,000; Transport Canada Rail Safety Improvement Program: $18,442,182"
2026-01-30,-,Big Picture Public Affairs,Spirits Canada,"Funke, Lee Russell Orvan",-,-,-,817017,Consultant,"Funke, Lee Russell Orvan",Consultant,Active,"LOBBYIST: Funke, Lee Russell Orvan | CLIENT: Spirits Canada | FIRM: Big Picture Public Affairs | STATUS: Active"
2026-01-30,-,Abilities Manitoba,Abilities Manitoba,Margo Powell,-,-,-,877458,In-House,"Powell, Margo",In-House,Active,"LOBBYING DESCRIPTION: 
ORGANIZATION DESCRIPTION: Non profit, incorporated, membership based, umbrella organization. Our members are non-profit organizations across MB who provide services and supports to adults with intellectual disabilities.
BUSINESS SUMMARY: Advocacy on behalf of non profit organizations who provide services to adults with intellectual disabilities in the province of Manitoba.
GOVERNMENT FUNDING: Department of Families: $50,000"
2026-01-29,-,FGS Longview,Cytophage Technologies Ltd.,"Sawatzky, Jeremy",-,-,-,857671,Consultant,"Sawatzky, Jeremy",Consultant,Active,"LOBBYIST: Sawatzky, Jeremy | CLIENT: Cytophage Technologies Ltd. | FIRM: FGS Longview | STATUS: Active"
2026-01-26,-,The Wawanesa Mutual Insurance Company,The Wawanesa Mutual Insurance Company,Evan Johnston,-,-,-,866999,In-House,"Finley, Michelle",In-House,Active,"LOBBYING DESCRIPTION: 
ORGANIZATION DESCRIPTION: Wawanesa is a Canadian mutual insurance firm owned by its policyholders.
BUSINESS SUMMARY: The  principal business of The Wawanesa Mutual Insurance Company (“Wawanesa”) is property and casualty (""P&C"") insurance, which it writes throughout Canada and distributes by means of a network of independent insurance brokers. One of these brokers, Western Financial Group (Network) Inc., is a wholly-owned subsidiary of Wawanesa. Wawanesa's P&C insurance products include personal and commercial property, automobile and farm insurance products.

In addition, Wawanesa writes both life and accident and sickness insurance on individual and group bases through another of its wholly owned subsidiaries, The Wawanesa Life Insurance Company.
GOVERNMENT FUNDING: "
2026-01-21,-,Organigram Global,Organigram Global,James Yamanaka,-,-,-,876627,In-House,"Bishop, Michael",In-House,Active,"LOBBYING DESCRIPTION: 
ORGANIZATION DESCRIPTION: Organigram Global Inc. is a NASDAQ Global Select Market and TSX listed company whose wholly owned subsidiaries include Organigram Inc., a licensed cultivator and processor. Through its recent acquisition of Collective Project Limited, Organigram participates in the US and Canadian cannabinoid beverages markets. Organigram is focused on producing high-quality cannabis for adult consumers, as well as developing international business partnerships to extend the Company's global footprint.
BUSINESS SUMMARY: Organigram Global is a licensed producer of medical and adult-use cannabis
GOVERNMENT FUNDING: Next Generation Manufacturing Canada, a federal initiative under Canada’s Innovation Superclusters Initiative: $37,311; Opportunities New Brunswick: $2,000,000"
2026-01-21,-,High Tide Inc,High Tide Inc,"Gardner, Matthew",-,-,-,876748,Consultant,"Gardner, Matthew",Consultant,Active,"LOBBYIST: Gardner, Matthew | CLIENT: High Tide Inc | FIRM:  | STATUS: Active"
2026-01-21,-,Prairie Sky Strategy,Graham Group Ltd.,"Tamoto, Connie",-,-,-,876818,Consultant,"Tamoto, Connie",Consultant,Active,"LOBBYIST: Tamoto, Connie | CLIENT: Graham Group Ltd. | FIRM: Prairie Sky Strategy | STATUS: Active"
2026-01-20,-,Chadwick Consulting,Manitoba Association of Landscape Architects,"Garrett, Tom",-,-,-,760054,Consultant,"Garrett, Tom",Consultant,Active,"LOBBYIST: Garrett, Tom | CLIENT: Manitoba Association of Landscape Architects | FIRM: Chadwick Consulting | STATUS: Active"
2026-01-19,-,3Sixty Public Affairs,Cancer Clinician Advocacy Forum,"Allerton, Kerry",-,-,-,805930,Consultant,"Allerton, Kerry",Consultant,Active,"LOBBYIST: Allerton, Kerry | CLIENT: Cancer Clinician Advocacy Forum | FIRM: 3Sixty Public Affairs | STATUS: Active"
2026-01-15,-,Grid Solar Solutions,Grid Solar Solutions,Stephanie Brandman Smith,-,-,-,876011,In-House,"Brandman Smith, Stephanie",In-House,Active,"LOBBYING DESCRIPTION: 
ORGANIZATION DESCRIPTION: The organization is a privately owned, for-profit corporation incorporated in Ontario that operates on a commercial basis on its own behalf.
BUSINESS SUMMARY: Grid Solar Solutions brings forward a scalable infrastructure concept focused on facilitation local food production, energy reliability, and water resilience in remote and underserved communities through integrated, climate-adaptive systems that support long-term self-sufficiency.
GOVERNMENT FUNDING: "
2026-01-15,-,Natural Health Practitioners of Canada (NHPC),Natural Health Practitioners of Canada (NHPC),Tendai Nzuma,-,-,-,873264,In-House,"Donovan, Paul, Nzuma, Tendai",In-House,Active,"LOBBYING DESCRIPTION: 
ORGANIZATION DESCRIPTION: The Natural Health Practitioners of Canada (NHPC) is national, not-for-profit, member health association that represents over 7,000 holistic health professionals. We recognize more than 60 holistic health practices, including massage therapy, reflexology, reiki, craniosacral therapy, shiatsu, and Thai massage.
BUSINESS SUMMARY: The Natural Health Practitioners of Canada (NHPC) is working to transform health care in Canada by creating education and actively supporting a community that embodies the ideas of health, wellness and prevention through practices that address body, mind, spirit, community and environment. It does this through research, advocacy and education and by supporting and maintaining a strong membership.
GOVERNMENT FUNDING: "
2026-01-12,-,Global Public Affairs,Canadian Standards Association,"Williamson, Matt",-,-,-,826528,Consultant,"Williamson, Matt",Consultant,Active,"LOBBYIST: Williamson, Matt | CLIENT: Canadian Standards Association | FIRM: Global Public Affairs | STATUS: Active"
2026-01-09,-,Manitoba Real Estate Association,Manitoba Real Estate Association,"Mackintosh, Gord",-,-,-,866767,Consultant,"Mackintosh, Gord",Consultant,Active,"LOBBYIST: Mackintosh, Gord | CLIENT: Manitoba Real Estate Association | FIRM:  | STATUS: Active"
2026-01-08,-,Rubicon Strategy,Alamos Gold,"Levesque, Samira",-,-,-,866793,Consultant,"Levesque, Samira",Consultant,Active,"LOBBYIST: Levesque, Samira | CLIENT: Alamos Gold | FIRM: Rubicon Strategy | STATUS: Active"
2026-01-06,-,Impact Public Affairs,Canadian Urban Transit Association,"Ball, James",-,-,-,818286,Consultant,"Ball, James",Consultant,Active,"LOBBYIST: Ball, James | CLIENT: Canadian Urban Transit Association | FIRM: Impact Public Affairs | STATUS: Active"
2026-01-06,-,Wellington Advocacy,Convenience Industry Council of Canada,"Csillag, Peter",-,-,-,760504,Consultant,"Csillag, Peter",Consultant,Active,"LOBBYIST: Csillag, Peter | CLIENT: Convenience Industry Council of Canada | FIRM: Wellington Advocacy | STATUS: Active"
2026-01-06,-,Wellington Advocacy,Progressive Contractors Association of Canada,"Csillag, Peter",-,-,-,795290,Consultant,"Csillag, Peter",Consultant,Active,"LOBBYIST: Csillag, Peter | CLIENT: Progressive Contractors Association of Canada | FIRM: Wellington Advocacy | STATUS: Active"
2026-01-06,-,Clear Strategy,DoorDash,"MacLauchlan, Sherry",-,-,-,689871,Consultant,"MacLauchlan, Sherry",Consultant,Active,"LOBBYIST: MacLauchlan, Sherry | CLIENT: DoorDash | FIRM: Clear Strategy | STATUS: Active"
2026-01-06,-,Wellington Advocacy,Convenience Industry Council of Canada,"Wilde, Ashley",-,-,-,794522,Consultant,"Wilde, Ashley",Consultant,Active,"LOBBYIST: Wilde, Ashley | CLIENT: Convenience Industry Council of Canada | FIRM: Wellington Advocacy | STATUS: Active"
2026-01-05,-,Sutherland Corporation,Pipe Line Contractors Association of Canada,"Smith, Ben",-,-,-,866082,Consultant,"Smith, Ben",Consultant,Active,"LOBBYIST: Smith, Ben | CLIENT: Pipe Line Contractors Association of Canada | FIRM: Sutherland Corporation | STATUS: Active"
2025-12-22,-,Enterprise Canada,Google Cloud Canada Corporation,"McKinnon, Michael",-,-,-,732164,Consultant,"McKinnon, Michael",Consultant,Active,"LOBBYIST: McKinnon, Michael | CLIENT: Google Cloud Canada Corporation | FIRM: Enterprise Canada | STATUS: Active"
2025-12-18,-,Counsel Public Affairs Inc.,High Tide Inc.,"Mason, Jodee",-,-,-,704212,Consultant,"Mason, Jodee",Consultant,Active,"LOBBYIST: Mason, Jodee | CLIENT: High Tide Inc. | FIRM: Counsel Public Affairs Inc. | STATUS: Active"
2025-12-18,-,Temple Scott Associates Inc.,Imperial Tobacco Canada Limited,"Rayner, Duncan",-,-,-,1937101,Consultant,"Rayner, Duncan",Consultant,Active,"LOBBYIST: Rayner, Duncan | CLIENT: Imperial Tobacco Canada Limited | FIRM: Temple Scott Associates Inc. | STATUS: Active"
2025-12-15,-,Remedy Government Relations,Forest Industry Association of Manitoba,"Morris, John",-,-,-,861712,Consultant,"Morris, John",Consultant,Active,"LOBBYIST: Morris, John | CLIENT: Forest Industry Association of Manitoba | FIRM: Remedy Government Relations | STATUS: Active"
2025-12-15,-,Remedy Government Relations,Molson Coors,"Morris, John",-,-,-,505523,Consultant,"Morris, John",Consultant,Active,"LOBBYIST: Morris, John | CLIENT: Molson Coors | FIRM: Remedy Government Relations | STATUS: Active"
2025-12-10,-,Peg City Car Co-op,Peg City Car Co-op,"Penner, Darcy",-,-,-,861447,Consultant,"Penner, Darcy",Consultant,Active,"LOBBYIST: Penner, Darcy | CLIENT: Peg City Car Co-op | FIRM:  | STATUS: Active"
2025-12-08,-,Chadwick Consulting,Valley Fiber,"Garrett, Tom",-,-,-,821258,Consultant,"Garrett, Tom",Consultant,Active,"LOBBYIST: Garrett, Tom | CLIENT: Valley Fiber | FIRM: Chadwick Consulting | STATUS: Active"
2025-12-02,-,Chadwick Consulting Ltd.,Frontiers North Adventures,"Dumont, Jamie",-,-,-,858386,Consultant,"Dumont, Jamie",Consultant,Active,"LOBBYIST: Dumont, Jamie | CLIENT: Frontiers North Adventures | FIRM: Chadwick Consulting Ltd. | STATUS: Active"
2025-12-02,-,Chadwick Consulting Ltd.,National Indian Residential School Museum,"Dumont, Jamie",-,-,-,858414,Consultant,"Dumont, Jamie",Consultant,Active,"LOBBYIST: Dumont, Jamie | CLIENT: National Indian Residential School Museum | FIRM: Chadwick Consulting Ltd. | STATUS: Active"
2025-12-02,-,Counsel Public Affairs Inc.,STARS,"Mason, Jodee",-,-,-,704283,Consultant,"Mason, Jodee",Consultant,Active,"LOBBYIST: Mason, Jodee | CLIENT: STARS | FIRM: Counsel Public Affairs Inc. | STATUS: Active"
2025-12-01,-,Chadwick Consulting,Arctic Gateway Group,"Hartle, Brad",-,-,-,858209,Consultant,"Hartle, Brad",Consultant,Active,"LOBBYIST: Hartle, Brad | CLIENT: Arctic Gateway Group | FIRM: Chadwick Consulting | STATUS: Active"
2025-11-27,-,Global Public Affairs,Maple Leaf Foods,"Crawford-Ritchie, Isaac",-,-,-,622731,Consultant,"Crawford-Ritchie, Isaac",Consultant,Active,"LOBBYIST: Crawford-Ritchie, Isaac | CLIENT: Maple Leaf Foods | FIRM: Global Public Affairs | STATUS: Active"
2025-11-26,-,Counsel Public Affairs,The Surety Association of Canada,"Mason, Jodee",-,-,-,768080,Consultant,"Mason, Jodee",Consultant,Active,"LOBBYIST: Mason, Jodee | CLIENT: The Surety Association of Canada | FIRM: Counsel Public Affairs | STATUS: Active"
2025-11-25,-,"BioCryst Canada, ULC","BioCryst Canada, ULC","Mason, Jodee",-,-,-,857722,Consultant,"Mason, Jodee",Consultant,Active,"LOBBYIST: Mason, Jodee | CLIENT: BioCryst Canada, ULC | FIRM:  | STATUS: Active"
2025-11-20,-,Global Public Affairs,Maple Bear Inc. (d/b/a Instacart),"Crawford-Ritchie, Isaac",-,-,-,857636,Consultant,"Crawford-Ritchie, Isaac",Consultant,Active,"LOBBYIST: Crawford-Ritchie, Isaac | CLIENT: Maple Bear Inc. (d/b/a Instacart) | FIRM: Global Public Affairs | STATUS: Active"
