2026-05-04,-,Innovative Medicines Canada (Médicaments novateurs Canada),Innovative Medicines Canada (Médicaments novateurs Canada),Bettina Hamelin,-,-,-,890249,In-House,"Best, Patricia, Brown, Charles, Debolt, Michael, Dietrich, Michael, Farago, Joe, Hamelin, Bettina",In-House,Active,"LOBBYING DESCRIPTION: 
ORGANIZATION DESCRIPTION: Innovative Medicines Canada is comprised of member companies that range from early-stage startups to established organizations and are revolutionizing healthcare through the discovery and development of new medicines and vaccines. The categories of memberships are: (a) Full membership, which is open to innovative pharmaceutical companies that research, develop, manufacture, and/or distribute pharmaceutical prescription preparations under their own labels in Canada;and(b)Life Sciences Association
BUSINESS SUMMARY: Innovative Medicines Canada represents Canada's innovative pharmaceutical industry. We help our members discover, develop and deliver innovative medicines and vaccines. Our member companies, which range from early-stage startups to established organizations, are revolutionizing healthcare through the discovery and development of new medicines and vaccines. Guided by a strict Code of Ethical Practices, we work with governments, insurance companies, healthcare professionals and other stakeholders to advance the field of pharmaceutical research and development and enhance the wellbeing of Canadians. We are committed to being valued partners in Canada's healthcare system. We achieve our goals by forming alliances, supporting policies, improving Canada's regulatory environment, widening access to innovative medicines and ensuring the effective protection of intellectual property.
GOVERNMENT FUNDING: None: $0"
2026-05-04,-,Enterprise Canada,Enbridge inc.,"McKinnon, Michael",-,-,-,920884,Consultant,"McKinnon, Michael",Consultant,Active,"LOBBYIST: McKinnon, Michael | CLIENT: Enbridge inc. | FIRM: Enterprise Canada | STATUS: Active"
2026-05-04,-,Enterprise Canada,Google Canada Corporation,"McKinnon, Michael",-,-,-,920927,Consultant,"McKinnon, Michael",Consultant,Active,"LOBBYIST: McKinnon, Michael | CLIENT: Google Canada Corporation | FIRM: Enterprise Canada | STATUS: Active"
2026-04-30,-,7-Eleven Canada Inc.,7-Eleven Canada Inc.,Marc Goodman,-,-,-,920736,In-House,"Vrsnik, Victor",In-House,Active,"LOBBYING DESCRIPTION: 
ORGANIZATION DESCRIPTION: Corporation
BUSINESS SUMMARY: 7-Eleven Canada owns and operates retail & food service stores in Manitoba. It markets and retails foods and beverages, frozen and packaged products, age-restricted products, gasoline, cosmetics and other retail products.
GOVERNMENT FUNDING: "
2026-04-30,-,Impact Public affairs,Associated Equipment Distributors,"Price, Jalen",-,-,-,920612,Consultant,"Price, Jalen",Consultant,Active,"LOBBYIST: Price, Jalen | CLIENT: Associated Equipment Distributors | FIRM: Impact Public affairs | STATUS: Active"
2026-04-28,-,Second Harvest,Second Harvest,Lori Nikkel,-,-,-,920522,In-House,"Grant, Allyson, Nikkel, Lori",In-House,Active,"LOBBYING DESCRIPTION: 
ORGANIZATION DESCRIPTION: Registered charity
BUSINESS SUMMARY: Second Harvest works with with food businesses from across the supply chain to redirect surplus food to non-profit organizations in every province and territory.¿
GOVERNMENT FUNDING: Agriculture and Agri-Food Canada (AAFC): $2,750,000; Government of Newfoundland: $57,873; Ontario Trillium Fund: $260,500"
2026-04-27,-,CNT Management Group Inc.,Canadian Crane Rental Association,"Belanger-Parker, Claire",-,-,-,920404,Consultant,"Belanger-Parker, Claire",Consultant,Active,"LOBBYIST: Belanger-Parker, Claire | CLIENT: Canadian Crane Rental Association | FIRM: CNT Management Group Inc. | STATUS: Active"
2026-04-27,-,Automotive Industries Association of Canada,Automotive Industries Association of Canada,Emily Holtby,-,-,-,920340,In-House,"Champagne, Jean-Francois, Chung, Emily, Holtby, Emily",In-House,Active,"LOBBYING DESCRIPTION: 
ORGANIZATION DESCRIPTION: Members include manufacturers and distributors, parts stores and service and repair shops, importers, business services, manufacturers’ representatives and more. Our membership represents the entire automotive aftermarket if you buy from, sell to or make your living in the auto care industry.
BUSINESS SUMMARY: The Automotive Industries Association of Canada is the voice and resource that leads innovation in Canada’s auto care industry.
GOVERNMENT FUNDING: Ontario Ministry of Labour, Training and Skills Development: $2,738,759"
2026-04-27,-,Hill & Knowlton,"Dexcom Canada, Co.","Sigalet, Natalie",-,-,-,920431,Consultant,"Sigalet, Natalie",Consultant,Active,"LOBBYIST: Sigalet, Natalie | CLIENT: Dexcom Canada, Co. | FIRM: Hill & Knowlton | STATUS: Active"
2026-04-24,-,TIPI Group of Companies,TIPI Group of Companies,"Gardner, Matthew",-,-,-,878548,Consultant,"Gardner, Matthew",Consultant,Active,"LOBBYIST: Gardner, Matthew | CLIENT: TIPI Group of Companies | FIRM:  | STATUS: Active"
2026-04-24,-,TIPI Group of Companies,TIPI Group of Companies,"Mason, Jodee",-,-,-,878578,Consultant,"Mason, Jodee",Consultant,Active,"LOBBYIST: Mason, Jodee | CLIENT: TIPI Group of Companies | FIRM:  | STATUS: Active"
2026-04-22,-,Counsel Public Affairs Inc,Emergent BioSolutions Canada Inc. (formerly Adapt Pharma Canada Ltd.),"LaForce, Kait",-,-,-,920008,Consultant,"LaForce, Kait",Consultant,Active,"LOBBYIST: LaForce, Kait | CLIENT: Emergent BioSolutions Canada Inc. (formerly Adapt Pharma Canada Ltd.) | FIRM: Counsel Public Affairs Inc | STATUS: Active"
2026-04-22,-,Remedy Government Relations,Mining Association of Manitoba Inc.,"Morris, John",-,-,-,439163,Consultant,"Morris, John",Consultant,Active,"LOBBYIST: Morris, John | CLIENT: Mining Association of Manitoba Inc. | FIRM: Remedy Government Relations | STATUS: Active"
2026-04-20,-,JTI-Macdonald,JTI-Macdonald,Paul Hennessy,-,-,-,919717,In-House,"Naveda, Matthew",In-House,Active,"LOBBYING DESCRIPTION: 
ORGANIZATION DESCRIPTION: JTI Macdonald is a Canadian based company that is part of the JTI Group.
BUSINESS SUMMARY: We are a company that manufacture and distribute tobacco and nicotine products.
GOVERNMENT FUNDING: "
2026-04-20,-,McKesson Canada Corporation,McKesson Canada Corporation,Dimitris Polygenis,-,-,-,919602,In-House,"Leong, Anthony, Sharma, Hitesh",In-House,Active,"LOBBYING DESCRIPTION: 
ORGANIZATION DESCRIPTION: Corporation
BUSINESS SUMMARY: A leader provider of healthcare solutions across Canada
GOVERNMENT FUNDING: "
2026-04-17,-,Jangula and Company Consulting,Canadian Craft Brewers Association,"Jangula, Craig",-,-,-,402433,Consultant,"Jangula, Craig",Consultant,Active,"LOBBYIST: Jangula, Craig | CLIENT: Canadian Craft Brewers Association | FIRM: Jangula and Company Consulting | STATUS: Active"
2026-04-16,-,Fasken Martineau DuMoulin LLP,Qikiqtaaluk Arctic Economic Development Limited Partnership,"Gregoire, Dana",-,-,-,878655,Consultant,"Gregoire, Dana",Consultant,Active,"LOBBYIST: Gregoire, Dana | CLIENT: Qikiqtaaluk Arctic Economic Development Limited Partnership | FIRM: Fasken Martineau DuMoulin LLP | STATUS: Active"
2026-04-15,-,Whirlpool Canada LP,Whirlpool Canada LP,Gary Power,-,-,-,892532,In-House,"Ellacott, Warrington",In-House,Active,"LOBBYING DESCRIPTION: 
ORGANIZATION DESCRIPTION: Whirlpool Corporation (NYSE:WHR) is a global company with $16B USD in annual sales, 41,000 employees and 35 manufacturing and technology centres.
BUSINESS SUMMARY: Wholesale distribution and service - home appliances - durable goods
GOVERNMENT FUNDING: "
2026-04-14,-,Chadwick Consulting Ltd.,Nukik Corporation,"Findlater, Katie",-,-,-,743697,Consultant,"Findlater, Katie",Consultant,Active,"LOBBYIST: Findlater, Katie | CLIENT: Nukik Corporation | FIRM: Chadwick Consulting Ltd. | STATUS: Active"
2026-04-13,-,Neighbourhood Pharmacy Association,Neighbourhood Pharmacy Association,Sandra Hanna,-,-,-,918967,In-House,"Hanna, Sandra",In-House,Active,"LOBBYING DESCRIPTION: 
ORGANIZATION DESCRIPTION: We are a not-for-profit advocacy Association. Our members include chain, banner, long-term care, specialty and independent pharmacies, including grocery chains and mass merchandisers with pharmacies.
BUSINESS SUMMARY: We represent the business of pharmacy and advocate for Canada's leading pharmacy organizations in all models including chain, banner, long-term care, specialty and independent pharmacies, as well as grocery chains and mass merchandisers with pharmacies. Our goal is to achieve a sustainable pharmacy future by bringing strategic initiatives forward, forming effective alliances, and improving Canada's pharmacy environment.
GOVERNMENT FUNDING: "
2026-04-13,-,Crestview Strategy,Canadian Trucking Alliance,"Hudyma, Jordan",-,-,-,919028,Consultant,"Hudyma, Jordan",Consultant,Active,"LOBBYIST: Hudyma, Jordan | CLIENT: Canadian Trucking Alliance | FIRM: Crestview Strategy | STATUS: Active"
2026-04-10,-,Canadian Renewable Energy Association,Canadian Renewable Energy Association,Vittoria Bellissimo,-,-,-,918005,In-House,"Hall, Kelly",In-House,Active,"LOBBYING DESCRIPTION: 
ORGANIZATION DESCRIPTION: The Association’s 300+ members represent the full scope of the sector and are uniquely positioned to deliver clean, low-cost, reliable, flexible and scalable solutions for Canada’s energy needs.

Jason Chee-Aloy (Chair), Michelle Chislett (Past Chair), Jen Aitchison (Vice-Chair), Ian MacRobbie (Treasurer), Lisa Asbreuk (Secretary), Cory Basil, Sarah Bresolin, Frank Davis, Jackie Forrest, Suha Jethalal, Eva Lotta Schmidt, Roslyn McMann, Terri-Lee Oleniuk, Adam Rosso, Gary Thompson
BUSINESS SUMMARY: The Canadian Renewable Energy Association is a multi-technology industry association that provides a unified voice for solar energy, wind energy, and energy storage in Canada. The Association will advance the interests of the solar energy, wind energy and energy storage industries, and promote their deployment across Canada – from front-of-the-meter applications at the utility-scale to behind-the-meter projects such as microgrids as well as residential uses.
GOVERNMENT FUNDING: Electricity Human Resources Canada: $19,861; Natural Resources Canada: $295,137; United Nations Association in Canada: $3,250"
2026-04-10,-,Chadwick Consulting,Arctic Gateway Group,"Garrett, Tom",-,-,-,761136,Consultant,"Garrett, Tom",Consultant,Active,"LOBBYIST: Garrett, Tom | CLIENT: Arctic Gateway Group | FIRM: Chadwick Consulting | STATUS: Active"
2026-04-10,-,Chadwick Consulting Ltd.,Frontiers North Adventures,"Garrett, Tom",-,-,-,698308,Consultant,"Garrett, Tom",Consultant,Active,"LOBBYIST: Garrett, Tom | CLIENT: Frontiers North Adventures | FIRM: Chadwick Consulting Ltd. | STATUS: Active"
2026-04-10,-,Chadwick Consulting Ltd.,Nukik Corporation,"Garrett, Tom",-,-,-,695898,Consultant,"Garrett, Tom",Consultant,Active,"LOBBYIST: Garrett, Tom | CLIENT: Nukik Corporation | FIRM: Chadwick Consulting Ltd. | STATUS: Active"
2026-04-10,-,Chadwick Consulting Ltd.,Tourism Industry Association of Manitoba (TIAM),"Garrett, Tom",-,-,-,698440,Consultant,"Garrett, Tom",Consultant,Active,"LOBBYIST: Garrett, Tom | CLIENT: Tourism Industry Association of Manitoba (TIAM) | FIRM: Chadwick Consulting Ltd. | STATUS: Active"
2026-04-10,-,Chadwick Consulting,University College of the North,"Garrett, Tom",-,-,-,760106,Consultant,"Garrett, Tom",Consultant,Active,"LOBBYIST: Garrett, Tom | CLIENT: University College of the North | FIRM: Chadwick Consulting | STATUS: Active"
2026-04-09,-,Chadwick Consulting,University College of the North,"Dumont, Jamie",-,-,-,761094,Consultant,"Dumont, Jamie",Consultant,Active,"LOBBYIST: Dumont, Jamie | CLIENT: University College of the North | FIRM: Chadwick Consulting | STATUS: Active"
2026-04-09,-,Chadwick Consulting Ltd.,Tourism Industry Association of Manitoba (TIAM),"Dumont, Jamie",-,-,-,698406,Consultant,"Dumont, Jamie",Consultant,Active,"LOBBYIST: Dumont, Jamie | CLIENT: Tourism Industry Association of Manitoba (TIAM) | FIRM: Chadwick Consulting Ltd. | STATUS: Active"
2026-04-09,-,The Explorers and Producers Association of Canada,The Explorers and Producers Association of Canada,Tristan Goodman,-,-,-,918719,In-House,"Fulsom, Michael, Goodman, Tristan, Hussain, Taha, Montgomery, Chris, Paterson, Jennifer",In-House,Active,"LOBBYING DESCRIPTION: 
ORGANIZATION DESCRIPTION: EPAC is incorporated as a federal Not for Profit corporation.  The
members of EPAC are primarily oil and gas production companies.
BUSINESS SUMMARY: EPAC is an advocacy group representing approximately 80 Canadian
headquartered oil and gas production companies and other support
businesses.  We advocate for government fiscal and regulatory policies
that encourage investment and job creation in the oil and gas industry
in Canada.
GOVERNMENT FUNDING: "
2026-04-07,-,Canadian Medical Association,Canadian Medical Association,Alex Munter,-,-,-,887960,In-House,"Adams, Owen, Ah-Kiow, Estelle, Baker, Alana, Blachar, Emma, Blackmer, Jeff, Burnell, Margot, Chisholm, Ashley, Grandmaison, Audrey, Hodgins Musgrave, Taylor, Kitts, Jennifer, Lessard, Francois, Lewis, Eric, Munter, Alex, Neeson, Jasmine, Ogunyemi, Dr. Bolu, Shuhendler, Karey, Smith, Kristin, Vail, Stephen, Yusuf, Kafia, Zimmer, Kenzie",In-House,Active,"LOBBYING DESCRIPTION: 
ORGANIZATION DESCRIPTION: The CMA's work is informed by the tens of thousands of doctors, residents and medical students across the country. Together, they reflect a range of backgrounds, types of practice and locations — rural, remote and urban.
BUSINESS SUMMARY: The Canadian Medical Association leads a national movement with physicians who believe in a better future of health. Our ambition is a sustainable, accessible health system where patients are partners, a culture of medicine that elevates equity, diversity and well-being, and supportive communities where everyone has the chance to be healthy. We drive change through advocacy, giving and knowledge sharing – guided by values of collaboration and inclusion.
GOVERNMENT FUNDING: "
2026-04-07,-,Civic Good,The Co-operators Group Limited,"Iveson, Don",-,-,-,917828,Consultant,"Iveson, Don",Consultant,Active,"LOBBYIST: Iveson, Don | CLIENT: The Co-operators Group Limited | FIRM: Civic Good | STATUS: Active"
2026-04-07,-,3Sixty Public Affairs,Adult Vaccine Alliance (AVA),"Kerry, Allerton",-,-,-,857460,Consultant,"Kerry, Allerton",Consultant,Active,"LOBBYIST: Kerry, Allerton | CLIENT: Adult Vaccine Alliance (AVA) | FIRM: 3Sixty Public Affairs | STATUS: Active"
2026-03-31,-,Consultation Esplanade Consulting Inc.,KortoJura Inc.,"Courcelles, Rémi",-,-,-,850029,Consultant,"Courcelles, Rémi",Consultant,Active,"LOBBYIST: Courcelles, Rémi | CLIENT: KortoJura Inc. | FIRM: Consultation Esplanade Consulting Inc. | STATUS: Active"
2026-03-31,-,Consultation Esplanade Consulting Inc.,Société de la francophonie manitobaine,"Courcelles, Rémi",-,-,-,627754,Consultant,"Courcelles, Rémi",Consultant,Active,"LOBBYIST: Courcelles, Rémi | CLIENT: Société de la francophonie manitobaine | FIRM: Consultation Esplanade Consulting Inc. | STATUS: Active"
2026-03-31,-,Counsel Public Affairs Inc,Teralta Hydrogen Solutions Inc,"Gardner, Matthew",-,-,-,917794,Consultant,"Gardner, Matthew",Consultant,Active,"LOBBYIST: Gardner, Matthew | CLIENT: Teralta Hydrogen Solutions Inc | FIRM: Counsel Public Affairs Inc | STATUS: Active"
2026-03-26,-,Canadian Federation of Independent Business (CFIB),Canadian Federation of Independent Business (CFIB),Brianna Solberg,-,-,-,893993,In-House,"Guenette, Jasmin, Howard, Sam, Kelly, Dan, Loeppky, Keyli, Mitton, Ryan, Pohlmann, Corinne, Slobogian, Tyler, Solberg , Brianna, Whidden, Bradlee, Yoo, SeoRhin",In-House,Active,"LOBBYING DESCRIPTION: 
ORGANIZATION DESCRIPTION: Owners of small- and medium-sized enterprises can voluntarily join CFIB. Our 103,000 members are located in every region of Canada, and with diversity in activity that closely parallels that of the country's economy.
BUSINESS SUMMARY: CFIB is a strictly non-partisan, not-for-profit, political action organization that seeks to give independent businesses in Canada a greater voice in determining the laws that govern business and the country. With a one-member, one-vote system, our members determine CFIB's political action agenda. CFIB ensures small enterprises have a voice at the table with government, big labour and big business.
GOVERNMENT FUNDING: "
2026-03-25,-,West Canitest R&D Inc (WestCaRD),Charles Boulais,"Hastings, Robert Roy",-,-,-,893856,Consultant,"Hastings, Robert Roy",Consultant,Active,"LOBBYIST: Hastings, Robert Roy | CLIENT: Charles Boulais | FIRM: West Canitest R&D Inc (WestCaRD) | STATUS: Active"
2026-03-23,-,Global Public Affairs,Manitoba Orthotics & Prosthetics Association,"Foroud , Farid",-,-,-,793522,Consultant,"Foroud , Farid",Consultant,Active,"LOBBYIST: Foroud , Farid | CLIENT: Manitoba Orthotics & Prosthetics Association | FIRM: Global Public Affairs | STATUS: Active"
2026-03-20,-,SWTCH Energy,SWTCH Energy,Carter Li,-,-,-,893646,In-House,"Cruickshank, Jason, Frisina, Michael",In-House,Active,"LOBBYING DESCRIPTION: 
ORGANIZATION DESCRIPTION: Corporate Business; EV Charging Network Operator.
BUSINESS SUMMARY: SWTCH is a leader in electric vehicle (EV) charging solutions for multi-tenant properties across North America. We work with building owners and operators to deploy EV charging that optimizes energy usage and revenue with cost-efficient and scalable infrastructure. Through our smart networked solution, SWTCH is making it possible to deploy EV charging at any multi-tenant property, regardless of local electrical constraints, from apartments and condos to workplaces and malls.
GOVERNMENT FUNDING: FedDev: $1,827,761; NRC - IRAP - LVC Program: $1,140,000; NRCAN: $1,594,697; OVIN: $12,500; CleanBC CVIC: $631,800; Global Affairs Canada: $26,000"
2026-03-19,-,Business Council of Canada,Business Council of Canada,Goldy Hyder,-,-,-,893476,In-House,"Hyder, Goldy",In-House,Active,"LOBBYING DESCRIPTION: 
ORGANIZATION DESCRIPTION: The Business Council is a business organization and a not-for-profit corporation.  Members are the chief executives of approximately 170 of Canada's largest corporations.
BUSINESS SUMMARY: THE BUSINESS COUNCIL OF CANADA (FORMERLY KNOWN AS THE CANADIAN COUNCIL OF CHIEF EXECUTIVES) IS A NON-PARTISAN AND NOT-FOR-PROFIT ORGANIZATION & THE SENIOR VOICE OF CANADIAN BUSINESS ON PUBLIC POLICY ISSUES IN CANADA & INTERNATIONALLY. THE COUNCIL ENGAGES IN AN ACTIVE PROGRAM OF RESEARCH, CONSULTATION & ADVOCACY & ITS FOCUS NATIONALLY IS TO HELP BUILD A STRONG ECONOMY, PROGRESSIVE SOCIAL POLICIES, & HEALTHY POLITICAL INSTITUTIONS.
GOVERNMENT FUNDING: "
2026-03-19,-,Enterprise Canada,Canadian Propane Association,"McKinnon, Michael",-,-,-,893343,Consultant,"McKinnon, Michael",Consultant,Active,"LOBBYIST: McKinnon, Michael | CLIENT: Canadian Propane Association | FIRM: Enterprise Canada | STATUS: Active"
2026-03-18,-,TransCanada PipeLines Limited,TransCanada PipeLines Limited,Francois Poirier,-,-,-,876043,In-House,"Baldwin, Riley, Boucher, Lane, Dunne, Ryan, Harrison, Brock, Holoiday, Leah, Laverty, Ryan, Mackay, Lindsay, Wichkam, Brittany",In-House,Active,"LOBBYING DESCRIPTION: 
ORGANIZATION DESCRIPTION: We are a vital part of everyday life—delivering the energy millions of people rely on to power their lives in a sustainable way. Thanks to a safe, reliable network of natural gas pipelines, along with power generation and storage facilities, wherever life happens — we’re there. Guided by our core values of safety, innovation, responsibility, collaboration and integrity, our people make a positive difference in the communities where we operate across Canada, the U.S. and Mexico
BUSINESS SUMMARY: We are a leading North American energy infrastructure company which operates in four business segments: Canadian Natural Gas Pipelines, U.S. Natural Gas Pipelines, Mexico Natural Gas Pipelines  and  Power and Energy Solutions. These segments offer different products and services, including certain natural gas transportation and storage services, and electricity marketing services. The Company also has a Corporate segment, consisting of corporate and administrative functions that provide governance, financing and other support to the Company's business segments.  On October 1, 2024, we successfully completed the spinoff of the Liquids Pipelines business.
GOVERNMENT FUNDING: Alberta Innovates: $346,805; Alberta Innovates: $100,000; Alberta Innovates: $4,805; Alberta Innovates: $39,647"
2026-03-18,-,MERCK CANADA INC.,MERCK CANADA INC.,David Jones,-,-,-,888777,In-House,"Chan, Jennifer, Houle, Philippe, Miyai, Wes, Nicholls, Christopher, Suter, Winnie, Swift, Lee, Waser, Heidi",In-House,Active,"LOBBYING DESCRIPTION: 
ORGANIZATION DESCRIPTION: Merck Canada Inc. is a federal non-distributing corporation with 50 or
fewer shareholders, extra-provincially registered in multiple provinces
including Manitoba.
BUSINESS SUMMARY: For more than 130 years, Merck, known as MSD outside of the United States and Canada, has been inventing for life, bringing forward medicines and vaccines for many of the world’s most challenging diseases in pursuit of our mission to save and improve lives. We demonstrate our commitment to patients and population health by increasing access to health care through far-reaching policies, programs and partnerships. Today, Merck continues to be at the forefront of research to prevent and treat diseases that threaten people and animals – including cancer, infectious diseases such as HIV and Ebola, and emerging animal diseases – as we aspire to be the premier research-intensive biopharmaceutical company in the world. 

In Canada, Merck markets a broad range of vaccines, pharmaceutical and animal health products and is one of the top R&D investors in Canada, with investments totaling $93.58 million in 2020 and more than $1.3 billion since 2000. Based in Kirkland, Québec, Merck employs approximately 592 people across the country. For more information about our operations in Canada, visit www.merck.ca and connect with us on YouTube and Twitter @MerckCanada.
GOVERNMENT FUNDING: "
2026-03-18,-,OpenCircle National Advocacy Ltd.,OpenCircle National Advocacy Ltd.,Ross Undershute,-,-,-,892861,In-House,"Coté, Lori, Schellenberger, Matt, Undershute, Ross",In-House,Active,"LOBBYING DESCRIPTION: 
ORGANIZATION DESCRIPTION: OpenCircle National Advocacy Ltd. (""OpenCircle National"") is a non-profit organization operating in conjunction with OpenCircle Membership Services and Workforce Development (""OpenCircle"")to advocate for the interests of its Membership in the construction and adjacent industry through public policy engagement and supporting member companies with resources and information to stay compliant on emerging legislations. OpenCircle represents 1700 companies and 50,000 employees.
BUSINESS SUMMARY: OpenCircle National Advocacy Ltd. is a non-profit organization operating in conjunction with OpenCircle Membership Services and Workforce Development, a not-for-profit company registered under the Companies Act in Alberta (collectively, the “Organization”).  The Organization provides members and their employees with access to health and welfare benefits, an RRSP program, training, public policy advocacy, scholarship and education awards, group discounts through affinity partnerships, and more. With respect to public policy advocacy, the Organization provides leadership and support for the advancement of government policies and programs that impact our members and their employees including the development, advancement, and ongoing support of the construction industry, support of under-represented populations within the industry, education and skilled trades advancement.
GOVERNMENT FUNDING: "
2026-03-17,-,"Gilead Sciences Canada, Inc","Gilead Sciences Canada, Inc",Paul Petrelli,-,-,-,892797,In-House,"Bigras, Diane",In-House,Active,"LOBBYING DESCRIPTION: 
ORGANIZATION DESCRIPTION: Gilead Sciences Canada Inc is a biopharmaceutical company
BUSINESS SUMMARY: Gilead Sciences Canada, Inc. is a biopharmaceuticalcompany that discovers, develops and commercializes innovative therapeutics in areas of unmet medical need. The company has a focus within the HIV, Hepatitis, antiviral agents for pandemic response for COVID-19, Oncology, Inflammation therapeutic areas.
GOVERNMENT FUNDING: "
2026-03-16,-,Fidelity Investments Canada ULC,Fidelity Investments Canada ULC,Rob Strickland,-,-,-,890669,In-House,"Burgess, Sian, Strickland, Rob",In-House,Active,"LOBBYING DESCRIPTION: 
ORGANIZATION DESCRIPTION: Fidelity Investments Canada ULC’s mission is to build better financial futures. With $363 billion in assets under management (as of March 12, 2026), Fidelity Investments Canada ULC is among the largest investment management companies offering Canadian investors and institutions a wide range of mutual funds and exchange traded funds.
BUSINESS SUMMARY: Fidelity Investments Canada ULC’s mission is to build better financial futures. With $363 billion in assets under management (as of March 12, 2026), Fidelity Investments Canada ULC is among the largest investment management companies offering Canadian investors and institutions a wide range of mutual funds and exchange traded funds.
GOVERNMENT FUNDING: "
2026-03-11,-,Impact Public Affairs,Canadian Association of Radiologists,"Ball, James",-,-,-,890790,Consultant,"Ball, James",Consultant,Active,"LOBBYIST: Ball, James | CLIENT: Canadian Association of Radiologists | FIRM: Impact Public Affairs | STATUS: Active"
