FILING DATE,TERMINATION DATE,ORGANIZATION,CLIENT NAME,DESIGNATED FILER,GOVERNMENT DEPARTMENT LOBBIED,PRESCRIBED PROVINCIAL ENTITY LOBBIED,SUBJECT MATTER OF LOBBYING,REGISTRATION NUMBER,TYPE OF LOBBYIST,LOBBYISTS,TYPE OF REGISTRATION,REGISTRATION STATUS,EXTRACTED_PDF_DETAILS
2026-07-13,-,Clean Economy Fund,Clean Economy Fund,Eric Campbell,-,-,-,933606,In-House,"Clark, Jason",In-House,Terminated,"LOBBYING DESCRIPTION: 
ORGANIZATION DESCRIPTION: Clean Economy Fund is a public foundation with the mission to rally more philanthropy for bold initiatives that support giant leaps towards a prosperous, net zero emission economy. Clean Economy Fund’s activities include research, convening, advocacy and grant-making. 

Clean Economy Fund is governed by a board of directors. Current directors include: Robert Spencer, Ersilia Serafini, Jane Rabinowicz, Bruce Lourie and J.P. Toussaint.
BUSINESS SUMMARY: The Clean Economy Fund supports bold net-zero economy initiatives.
GOVERNMENT FUNDING: "
2026-07-13,-,Breakfast Club of Canada,Breakfast Club of Canada,Julie Desharnais,-,-,-,867863,In-House,"Baker, Ryan, Barry, Judith, Desharnais, Julie",In-House,Terminated,"LOBBYING DESCRIPTION: 
ORGANIZATION DESCRIPTION: Breakfast Club of Canada is a non-profit organization that works with partners from all sectors to ensure breakfast programs are put in place so children across the country have access to the nutritious foods they need in the morning to develop fully.
BUSINESS SUMMARY: Breakfast Club of Canada works with partners from all sectors to ensure breakfast programs are put in place so children across the country have access to the nutritious foods they need in the morning to develop fully.
GOVERNMENT FUNDING: Gouvernement de l'Alberta: $100,000; Agriculture et Agroalimentaire Canada: $4,958,357; Gouvernement du Nouveau Brunswick: $460,900; Ministère de l'Agriculture, Pécherie et Alimentation: $133,272; Ministère de l'Education du Québec: $18,228,119; Cree Board of Health and Social Service of James Bay: $100,000; Cree Board School: $300,000; Government of Quebec: $0; Le Secrétariat Aux Relations avec les Premières Nations et les Inuit: $450,000; Ministère de la Famille du Québec: $876,473; Nunavik - Kativik Ilisarniliriniq School Board: $747,786; Services Autochtones Canada (SAC): $200,000; Ville de Montréal: $0; Cree Nation Government (CNG): $90,000"
2026-07-13,-,Boudeweel Public Affairs,AIA Canada,"David, Boudeweel-Lefebvre",-,-,-,853665,Consultant,"David, Boudeweel-Lefebvre",Consultant,Terminated,"LOBBYIST: David, Boudeweel-Lefebvre | CLIENT: AIA Canada | FIRM: Boudeweel Public Affairs | STATUS: Active"
2026-07-13,-,FGS Longview,"AST & Science, LLC","Sawatzky, Jeremy",-,-,-,937570,Consultant,"Sawatzky, Jeremy",Consultant,Active,"LOBBYIST: Sawatzky, Jeremy | CLIENT: AST & Science, LLC | FIRM: FGS Longview | STATUS: Active"
2026-07-10,-,Restaurants Canada,Restaurants Canada,Kelly Higginson,-,-,-,879488,In-House,"Barnier, Kris, Barnier, Kris",In-House,Active,"LOBBYING DESCRIPTION: 
ORGANIZATION DESCRIPTION: We are an organization (not for profit) of paid staff and volunteer board members. Our members are as diverse as the industry itself — from independent operators to regional and national restaurant chains, including restaurants, bars, caterers, franchisors, hotels, institutions, food trucks, convenience stores and other emerging business types. Our membership also includes industry suppliers, who play an integral role in the success of operators across Canada.
BUSINESS SUMMARY: Restaurants Canada is a national industry association that serves the foodservices industry. It conducts and shares research, provides member education, offers discounts to members, operates industry events, and advocates on behalf of its members.
GOVERNMENT FUNDING: Dine Ontario - OMAFRA: $11,533; Global Affairs Canada: $65,347; Ontario Skills Development Fund Training: $1,190,939"
2026-07-10,-,Doctors Manitoba,Doctors Manitoba,"Findlater, Katie",-,-,-,760323,Consultant,"Findlater, Katie",Consultant,Active,"LOBBYIST: Findlater, Katie | CLIENT: Doctors Manitoba | FIRM:  | STATUS: Active"
2026-07-10,-,Chadwick Consulting Ltd.,Doctors Manitoba,"Findlater, Katie",-,-,-,858446,Consultant,"Findlater, Katie",Consultant,Active,"LOBBYIST: Findlater, Katie | CLIENT: Doctors Manitoba | FIRM: Chadwick Consulting Ltd. | STATUS: Active"
2026-07-10,-,Chadwick Consulting,Doctors Manitoba,"Garrett, Tom",-,-,-,760196,Consultant,"Garrett, Tom",Consultant,Active,"LOBBYIST: Garrett, Tom | CLIENT: Doctors Manitoba | FIRM: Chadwick Consulting | STATUS: Active"
2026-07-08,-,The Manufacturers Life Insurance Company,The Manufacturers Life Insurance Company,Philip Witherington,-,-,-,918556,In-House,"Clark, Nathan",In-House,Active,"LOBBYING DESCRIPTION: 
ORGANIZATION DESCRIPTION: Corporation
BUSINESS SUMMARY: Delivery of financial services including insurance, health benefit plans, pensions and financial advice to individuals, groups and corporations including banking services through the subsidiary Manulife Bank and investments through the subsidiary Manulife Securities.
GOVERNMENT FUNDING: "
2026-07-07,-,Think Research Corporation,Think Research Corporation,Sachin Aggarwal,-,-,-,936489,In-House,"Aggarwal, Sachin, Sakamoto, Mark",In-House,Active,"LOBBYING DESCRIPTION: 
ORGANIZATION DESCRIPTION: Think Research Corporation is a private, for-profit business corporation. It is not a partnership, sole proprietorship, union, non-profit, or government entity. As a commercial technology company rather than a membership-based association or coalition, it does not have a membership base. Its structure consists solely of its shareholders, management, and employees.
BUSINESS SUMMARY: Think Research Corporation is a healthcare technology company specializing in knowledge-based, digital health software-as-a-service (SaaS) solutions. The organization gathers, develops, and delivers evidence-based clinical decision support tools, connectivity software, and data analytics. Its digital tools—including electronic order sets, virtual care applications, eReferrals, and clinical documentation forms—are designed to standardize care, streamline administrative workflows, and improve patient outcomes. Think Research licenses its cloud-based solutions globally to a wide range of health system stakeholders, including hospitals, long-term care facilities, primary care clinics, regional health authorities, and government agencies.
GOVERNMENT FUNDING: IPON: $16,182; CanExport: $9,025"
2026-07-07,-,TELUS Corporation,TELUS Corporation,Victor Dodig,-,-,-,936372,In-House,"Bacque, Ian, Lalli, Sangeeta, Seeley, Kathryn, Smith, Tyler",In-House,Active,"LOBBYING DESCRIPTION: 
ORGANIZATION DESCRIPTION: TELUS is a publicly traded company.
BUSINESS SUMMARY: TELUS (TSX: T, NYSE: TU) is a world-leading communications technology company operating in more than 45 countries and generating over 20 billion dollars in annual revenue with more than 20 million customer connections through our advanced suite of broadband services for consumers, businesses and the public sector. We are committed to leveraging our technology to enable remarkable human outcomes. TELUS is passionate about putting our customers and communities first, leading the way globally in client service excellence and social capitalism. TELUS Health is enhancing more than 160 million lives across 200 countries and territories through innovative preventive medicine and well-being technologies. TELUS Agriculture & Consumer Goods utilizes digital technologies and data insights to optimize the connection between producers and consumers. TELUS Digital specializes in digital customer experiences and future-focused digital transformations that deliver value for their global clients. Guided by our enduring 'give where we live' philosophy, TELUS, our team members and retirees have contributed 1.8 billion dollars in cash, in-kind contributions, time and programs including 2.4 million days of service since 2000, earning us the distinction of the world’s most giving company.
GOVERNMENT FUNDING: "
2026-07-07,-,Canadian Life and Health Insurance Association,Canadian Life and Health Insurance Association,Stephen Frank,-,-,-,936079,In-House,"Carnegie, Barbara, Duhaime, Lyne, Frank, Stephen, Hobbs, Sarah, Holman, Nathan, Kelsey, Erica, Laurence, Anna, McArthur, David, Mitchell, Jonathan, Murray, Susan, O'Connor, Luke",In-House,Active,"LOBBYING DESCRIPTION: 
ORGANIZATION DESCRIPTION: The CLHIA, established in 1894, is a voluntary association with 66
member companies accounting for over 99 per cent of Canada's life and health insurance business.
BUSINESS SUMMARY: The CLHIA is the national trade association for life and health insurers in Canada. Our members account for 99 per cent of Canada’s life and health insurance business. The industry provides a wide range of financial security products such as life insurance, annuities, and supplementary health insurance.
GOVERNMENT FUNDING: "
2026-07-07,-,Alamos Gold Inc.,Alamos Gold Inc.,John McCluskey,-,-,-,922370,In-House,"Clark, James, Fisher, Gregory, Fitzgerald, John, Guimond, Luc, McCluskey, John, Parsons, Scott, Thompson, Rebecca, Webster, Colin",In-House,Terminated,"LOBBYING DESCRIPTION: 
ORGANIZATION DESCRIPTION: Gold Mining Company
BUSINESS SUMMARY: Alamos Gold Inc. is a Canadian-based intermediate gold producer with diversified production from three operating mines in North America, including the Young-Davidson mine and Island Gold District in Northern Ontario, Canada, and the Mulatos District in Sonora, Mexico. Additionally, the Company has a significant portfolio of growth projects, including the Phase 3+ Expansion at Island Gold and the Lynn Lake project in Manitoba, Canada. Alamos employs more than 2,400 people and is committed to the highest standards of sustainable development. The Company’s shares are traded on the TSX and the NYSE under the symbol “AGI”. 

This registration pertains specifically to matters related to Alamos Gold Inc.'s development stage gold mining project in Lynn Lake, Manitoba.
GOVERNMENT FUNDING: Manitoba Mineral Development Fund: $100,000"
2026-07-07,-,Cobalt Safety,Cobalt Safety,"Sharma, Mandeep",-,-,-,936468,Consultant,"Sharma, Mandeep",Consultant,Active,"LOBBYIST: Sharma, Mandeep | CLIENT: Cobalt Safety | FIRM:  | STATUS: Active"
2026-07-07,-,PAA Advisory | Conseils,Diageo Canada,"Van Groningen, Steve",-,-,-,452129,Consultant,"Van Groningen, Steve",Consultant,Active,"LOBBYIST: Van Groningen, Steve | CLIENT: Diageo Canada | FIRM: PAA Advisory | Conseils | STATUS: Active"
2026-07-06,-,Enbridge Inc.,Enbridge Inc.,Greg Ebel,-,-,-,935073,In-House,"April, Moon, Chegahno, Matthew, Ebel, Greg, Fernandez, Mike, Gruending, Colin, Hedgebeth, Reggie, Iversen, Devin, Karim, Salma, Loney, Steve, Majer, Teri, McNichol, Alex, Munckhof-Swain, Sam, Murray, Pat, Palak, Thomas, Schwartz, Tom, Wagner, Marsha, Weil, Marc, Wood , Kim",In-House,Active,"LOBBYING DESCRIPTION: 
ORGANIZATION DESCRIPTION: Enbridge Inc. is North America's premier energy infrastructure company. We deliver more than 3 million barrels of crude oil and liquids every day; about 65% of U.S.-bound Canadian crude oil exports; and about 20% of all natural gas consumed in the U.S. Our renewable projects (either operating or under construction) have the capacity to generate 5,124 MW net of emissions-free energy.
BUSINESS SUMMARY: Enbridge Inc. is North America's premier energy infrastructure company. We deliver more than 3 million barrels of crude oil and liquids every day; about 65% of U.S.-bound Canadian crude oil exports; and about 20% of all natural gas consumed in the U.S. Our renewable projects (either operating or under construction) have the capacity to generate 4,108 MW net of zero-emission energy.
GOVERNMENT FUNDING: Government of Canada: $5,846,923; Government of Ontario: $314,600; Government of British Columbia: $223,575"
2026-07-03,-,Maple Leaf Foods Inc.,Maple Leaf Foods Inc.,Curtis Frank,-,-,-,876399,In-House,"Frank, Curtis, Sullivan, Kathleen",In-House,Active,"LOBBYING DESCRIPTION: 
ORGANIZATION DESCRIPTION: Corporation
BUSINESS SUMMARY: Maple Leaf Foods is a Canadian multinational consumer-packaged food production company headquartered in Mississauga, Ontario. Founded over 100 years ago, it has evolved into a leading producer of high-quality protein products, including fresh, prepared, and plant-based options. The company is committed to sustainability, food safety, and community welfare. Maple Leaf Foods operates under various iconic brands and has a manufacturing presence in Canada and the U.S.
GOVERNMENT FUNDING: Canada Revenue Agency: $118,127; Agriculture and Agri Food Canada: $0; Government of Alberta: $0; Government of Manitoba: $421,148; Government of Ontario: $255,538; Innovation Science and Economic Development of Canada: $0; Natural Resources Canada: $0; City of Hamilton: $0; City of Indianapolis: $0; Government of Quebec: $0; Public Health Agency of Canada: $0"
2026-07-02,-,Nutrien Ltd.,Nutrien Ltd.,Ken Seitz,-,-,-,934916,In-House,"Baker, Cam, Goodman, Brian, Loewen, Kinga",In-House,Active,"LOBBYING DESCRIPTION: 
ORGANIZATION DESCRIPTION: Limited liability corporation
BUSINESS SUMMARY: Nutrien plays a critical role in Feeding the Future by helping growers to increase food production in a sustainable manner. Nutrien is the world's largest fertilizer company by capacity and operates the world's largest agricultural retail system.
GOVERNMENT FUNDING: "
2026-07-02,-,Global Public Affairs,VIN Verification Services Inc.,"Crawford-Ritchie, Isaac",-,-,-,816950,Consultant,"Crawford-Ritchie, Isaac",Consultant,Active,"LOBBYIST: Crawford-Ritchie, Isaac | CLIENT: VIN Verification Services Inc. | FIRM: Global Public Affairs | STATUS: Active"
2026-07-02,-,Crestview Strategy,Lyft Canada Inc.,"Hollands, Stefano",-,-,-,708620,Consultant,"Hollands, Stefano",Consultant,Active,"LOBBYIST: Hollands, Stefano | CLIENT: Lyft Canada Inc. | FIRM: Crestview Strategy | STATUS: Active"
2026-07-02,-,Enterprise Canada,AbbVie Corporation,"McKinnon, Michael",-,-,-,675507,Consultant,"McKinnon, Michael",Consultant,Active,"LOBBYIST: McKinnon, Michael | CLIENT: AbbVie Corporation | FIRM: Enterprise Canada | STATUS: Active"
2026-07-02,-,Enterprise Canada,Extendicare Inc.,"McKinnon, Michael",-,-,-,732191,Consultant,"McKinnon, Michael",Consultant,Active,"LOBBYIST: McKinnon, Michael | CLIENT: Extendicare Inc. | FIRM: Enterprise Canada | STATUS: Active"
2026-07-02,-,Enterprise Canada,McKesson Canada,"McKinnon, Michael",-,-,-,820227,Consultant,"McKinnon, Michael",Consultant,Active,"LOBBYIST: McKinnon, Michael | CLIENT: McKesson Canada | FIRM: Enterprise Canada | STATUS: Active"
2026-07-02,-,Enterprise Canada,PTI Transformers Inc,"McKinnon, Michael",-,-,-,732231,Consultant,"McKinnon, Michael",Consultant,Active,"LOBBYIST: McKinnon, Michael | CLIENT: PTI Transformers Inc | FIRM: Enterprise Canada | STATUS: Active"
2026-06-30,-,Deep Sky Corporation,Deep Sky Corporation,Alex Petre,-,-,-,934587,In-House,"De Luna, Phil, Lalonde, Fred, Petre, Alex",In-House,Active,"LOBBYING DESCRIPTION: 
ORGANIZATION DESCRIPTION: Deep Sky Corporation aims to scale and commercialize carbon removal and storage. It is headquartered in Montréal, Québec.
BUSINESS SUMMARY: Deep Sky Corporation aims to scale and commercialize carbon removal and storage. It is headquartered in Montréal, Québec.
GOVERNMENT FUNDING: Government of Québec (Investissement Québec): $90,000; Government of Québec (Ministry of Agriculture, Environment and Natural Resources): $600,000"
2026-06-29,-,Tactix Consulting,Kidde Canada Inc.,"Thorkelson, Ruth Irene",-,-,-,934536,Consultant,"Thorkelson, Ruth Irene",Consultant,Active,"LOBBYIST: Thorkelson, Ruth Irene | CLIENT: Kidde Canada Inc. | FIRM: Tactix Consulting | STATUS: Active"
2026-06-26,-,Impact Public Affairs,Associated Equipment Distributors,"Ball, James",-,-,-,934479,Consultant,"Ball, James",Consultant,Active,"LOBBYIST: Ball, James | CLIENT: Associated Equipment Distributors | FIRM: Impact Public Affairs | STATUS: Active"
2026-06-26,-,Johnson & Johnson (Canada) Inc.,Johnson & Johnson (Canada) Inc.,Robbie Levac,-,-,-,928794,In-House,"Joloudeva, Olga, Lavertu, Geneviève, Pasrija, Anuj",In-House,Active,"LOBBYING DESCRIPTION: 
ORGANIZATION DESCRIPTION: Johnson & Johnson (Canada) Inc. is a business corporation.
BUSINESS SUMMARY: Johnson & Johnson (Canada) Inc. is a subsidiary of US based Johnson & Johnson and is focused on the manufacture, development and sale of a broad range of products in the healthcare field, including medical devices and digital and robotic solutions and services. Johnson and Johnson (Canada) Inc. has no subsidiary companies, although another entity, Janssen Inc., which is also registered to lobby in Manitoba, may have a direct interest in its lobbying.
GOVERNMENT FUNDING: "
2026-06-25,-,Impact Public Affairs,Canadian Construction Association,"Bains, Nathan",-,-,-,934389,Consultant,"Bains, Nathan",Consultant,Active,"LOBBYIST: Bains, Nathan | CLIENT: Canadian Construction Association | FIRM: Impact Public Affairs | STATUS: Active"
2026-06-25,-,"Koch Government Affairs, LLC and Affiliates","Koch Government Affairs, LLC and Affiliates",Brian Henneberry,-,-,-,934009,In-House,"Brown, Paul, Mackay, Braden, Simonson, Kelly",In-House,Active,"LOBBYING DESCRIPTION: 
ORGANIZATION DESCRIPTION: Mixed business and industry corporation
BUSINESS SUMMARY: Government and public affairs services and production of fertilizer and
other products
GOVERNMENT FUNDING: "
2026-06-25,-,Temple Scott Associates Inc.,Farmers for Climate Solutions,"Matthewman, Joshua",-,-,-,934437,Consultant,"Matthewman, Joshua",Consultant,Active,"LOBBYIST: Matthewman, Joshua | CLIENT: Farmers for Climate Solutions | FIRM: Temple Scott Associates Inc. | STATUS: Active"
2026-06-25,-,Crestview Strategy,SkipTheDishes,"Wagner, Samira",-,-,-,867964,Consultant,"Wagner, Samira",Consultant,Active,"LOBBYIST: Wagner, Samira | CLIENT: SkipTheDishes | FIRM: Crestview Strategy | STATUS: Active"
2026-06-24,-,Impact Public Affairs,Pets Canada,"Ball, James",-,-,-,934320,Consultant,"Ball, James",Consultant,Active,"LOBBYIST: Ball, James | CLIENT: Pets Canada | FIRM: Impact Public Affairs | STATUS: Active"
2026-06-24,-,Chadwick Consulting Ltd,Engineers Geoscientists Manitoba,"Darragh, Lori",-,-,-,934343,Consultant,"Darragh, Lori",Consultant,Active,"LOBBYIST: Darragh, Lori | CLIENT: Engineers Geoscientists Manitoba | FIRM: Chadwick Consulting Ltd | STATUS: Active"
2026-06-23,-,Co-operative Housing Federation of Canada,Co-operative Housing Federation of Canada,Timothy Ross,-,-,-,873132,In-House,"Alderson, Dallas, Lockhart, Courtney, Norris, Michael, Ross, Timothy, Vaiaso, Maria, Yoon, Diana",In-House,Active,"LOBBYING DESCRIPTION: 
ORGANIZATION DESCRIPTION: We are a non-profit member association.  Our members include: non-profit housing co-ops (except in Quebec, where housing co-ops belong to CHF Canada through their local federations); federations of existing housing co-ops at the local/regional levels; groups that help housing co-ops; provincial co-op housing associations that represent and support housing co-op staff; land trusts that hold and protect land for housing co-ops; and sponsoring organizations.
BUSINESS SUMMARY: CHF Canada is a non-profit co-op association. Our services include research to support new co-op development and improve government support programs; representing our members; interests to government; developing and promoting national education materials for the co-op housing movement; organizing conferences and training forums, etc.; providing support to co-ops and member federations upon request; research on legal matters; publishing newsletters and bulletins for our members.
GOVERNMENT FUNDING: NS Dept of Municipal Affairs and Housing: $150,000; Housing Nova Scotia: $0; Canada Mortgage and Housing Corporation: $2,050,000; Ontario Ministry of Municipal Affairs and Housing: $119,090; PEI Ministry of Housing, Land and Communities: $150,000"
2026-06-23,-,Chartered Professional Accountants of Canada (CPA Canada) / Comptables professionnels agréés du Canada (CPA Canada),Chartered Professional Accountants of Canada (CPA Canada) / Comptables professionnels agréés du Canada (CPA Canada),Pamela Steer,-,-,-,919445,In-House,"Blagotic, Jovana, Steer, Pamela",In-House,Active,"LOBBYING DESCRIPTION: 
ORGANIZATION DESCRIPTION: Any individual holding a CPA designation in Canada or Bermuda can join CPA Canada as a member.
BUSINESS SUMMARY: Chartered Professional Accountants of Canada (CPA Canada) is one of the most influential accounting organizations in the world. 
 
As a non-regulatory body comprised of individual CPA members, CPA Canada supports the profession and represents Canadian CPAs at the national and international levels. Nationally, CPA Canada acts in the public interest to promote transparency in financial markets, prepares CPAs for a rapidly evolving business environment through extensive guidance and programming and contributes to standard setting and policy making. Globally, CPA Canada works together with international bodies to build a stronger accounting profession worldwide.
GOVERNMENT FUNDING: "
2026-06-23,-,Association of Regulated Nurses of Manitoba,Association of Regulated Nurses of Manitoba,Joyce Kristjansson,-,-,-,934220,In-House,"Kristjansson, Joyce, Scheveck, Pamela",In-House,Active,"LOBBYING DESCRIPTION: 
ORGANIZATION DESCRIPTION: Approximately 10,000 nurses joined in a professional voluntary non profit association.
BUSINESS SUMMARY: The Association of Regulated Nurses of Manitoba is the professional association representing licensed practical nurses (LPNs), registered psychiatric nurses (RPNs), nurse practitioners (NPs), registered nurses (RNs), graduate nurses, nursing students, Internationally Educated Nurses and former registered nurses in Manitoba.

Philosophy statement
We believe in supporting and promoting nursing across all settings – practice, education, research, leadership and policy. We believe in doing what’s best for our members and the health of people living in Manitoba. We further believe it is our responsibility to engage and inspire nurses to take pride in their profession and assume leadership in our community. We are champions of diversity, inclusivity, equity, social justice and democracy so we can all work together to create something better.
GOVERNMENT FUNDING: "
2026-06-22,-,Children's Aid Foundation of Canada,Children's Aid Foundation of Canada,Jeffrey Schiffer,-,-,-,878705,In-House,"McMurtry, Valerie, Rankin, Vanessa, Schiffer, Jeffrey",In-House,Active,"LOBBYING DESCRIPTION: 
ORGANIZATION DESCRIPTION: federally registered charitable organization
BUSINESS SUMMARY: We raise and grant funds and develop high-impact programs that are delivered in partnership with over 100 child- and youth-serving agencies across the country.
Children’s Aid Foundation of Canada is our country’s leading charity dedicated to improving the lives of children and youth and families involved in the child welfare system.
With the support of our donors and partners, we help children and youth involved with the child welfare system access the resources and opportunities they need to thrive.
GOVERNMENT FUNDING: Employment and Social Development Canada (rec’d in 2025-26): $0; Ministry of Children, Community and Social Service (Ontario; rec’d in 2025-26): $0"
2026-06-22,-,Canada Packers Inc.,Canada Packers Inc.,Dennis Organ,-,-,-,925290,In-House,"Organ, Dennis, Sawatzky, Jonathan",In-House,Active,"LOBBYING DESCRIPTION: 
ORGANIZATION DESCRIPTION: Canada Packers Inc is publicly traded under symbol CPKR.   Canada Packers Inc is a leading premium pork producer.
BUSINESS SUMMARY: Canada Packers Inc is a leading premium pork producer.
GOVERNMENT FUNDING: "
2026-06-18,-,FCA Canada Inc.,FCA Canada Inc.,Trevor Longley,-,-,-,933787,In-House,"Amilpa, Fernando, Deware, Chris, Gill, Inder",In-House,Active,"LOBBYING DESCRIPTION: 
ORGANIZATION DESCRIPTION: Automotive Manufacturer
BUSINESS SUMMARY: Auto Manufacturer - Sale of Chrysler, Jeep, Dodge, Ram, Fiat and Alfa Romeo
brand vehicles.  Two Canadian assembly plants and a castings plant located in Ontario.
GOVERNMENT FUNDING: "
2026-06-18,-,Interac Corp,Interac Corp,Jeremy Wilmot,-,-,-,933432,In-House,"Best, Nicolas, Hartwick, Vanessa",In-House,Active,"LOBBYING DESCRIPTION: 
ORGANIZATION DESCRIPTION: Interac Corp. is a for-profit partnership
BUSINESS SUMMARY: Interac is a 100% Canadian owned and operated payments and digital information exchange provider that helps individuals, businesses, and governments move money and information seamlessly. Our solutions are used over 20 million times a day—facilitating secure payments, digital verification and data-driven access to key government and business services.
GOVERNMENT FUNDING: "
