2026-06-18,-,Bell Canada,Bell Canada,Mirko Bibic,-,-,-,933002,In-House,"Bibic, Mirko, Goodfellow, Ashlee, Parkinson, Andrew, Rink, Dan, Watson, John",In-House,Active,"LOBBYING DESCRIPTION: 
ORGANIZATION DESCRIPTION: Bell Canada and its affiliates deliver a wide range of service innovations to consumers, businesses and government customers across Canada including wireless, Internet and TV, Wireless Home Internet, cloud and data hosting, IP voice and collaboration and Internet of Things.  Bell Media operates the country’s top media brands, and is a leading investor in Canadian content creation, including local television and radio news, sports and entertainment programming, and other original TV and film prod
BUSINESS SUMMARY: Bell Canada and its affiliates deliver a wide range of service innovations to consumers, businesses and government customers across Canada including wireless, Internet and TV, Wireless Home Internet, cloud and data hosting, IP voice and collaboration and Internet of Things.  Bell Media operates the country’s top media brands, and is a leading investor in Canadian content creation, including local television and radio news, sports and entertainment programming, and other original TV and film productions.  We are also one of Canada’s biggest retailers, with retail points of distribution across Canada.
GOVERNMENT FUNDING: Ontario Ministry of Infrastructure: $71,495,573; ISED: $25,076,926; Government of Quebec: $6,470,019; Town of Trout River, NL: $79,469"
2026-06-18,-,Consultation Esplanade Consulting Inc.,Manitoba Association of Residential & Community Care Homes for Everyone (MARCHE),"Courcelles, Rémi",-,-,-,878984,Consultant,"Courcelles, Rémi",Consultant,Active,"LOBBYIST: Courcelles, Rémi | CLIENT: Manitoba Association of Residential & Community Care Homes for Everyone (MARCHE) | FIRM: Consultation Esplanade Consulting Inc. | STATUS: Active"
2026-06-18,-,Consultation Esplanade Consulting Inc.,Santé en français inc.,"Courcelles, Rémi",-,-,-,876561,Consultant,"Courcelles, Rémi",Consultant,Active,"LOBBYIST: Courcelles, Rémi | CLIENT: Santé en français inc. | FIRM: Consultation Esplanade Consulting Inc. | STATUS: Active"
2026-06-18,-,Canadian Propane Association,Canadian Propane Association,Shannon Watt,-,-,-,933277,In-House,"Crawford, Chris, Loenhart, Robert, Watt, Shannon",In-House,Active,"LOBBYING DESCRIPTION: 
ORGANIZATION DESCRIPTION: CPA is an industry association that represents over 400 members along the value chain from producer to mid-stream to retailer to equipment manufacturers.
BUSINESS SUMMARY: The Canadian Propane Association represents the value chain of the propane industry (from producer to retailer) to government decision makers.
GOVERNMENT FUNDING: "
2026-06-18,-,Manitoba Pork Council,Manitoba Pork Council,Cameron Dahl,-,-,-,933647,In-House,"Dahl, Cameron, Melynchuk , Grant, Prejet, Rick",In-House,Active,"LOBBYING DESCRIPTION: 
ORGANIZATION DESCRIPTION: Non-profit organization established under the Farm products marketing Act. It operates under a Board of Directors.
BUSINESS SUMMARY: Manitoba Pork Council (MPC) is the provincial organization of hog producers. MPC develops and delivers a variety of universal swine progrqams on behalf of its members. A 10-member board of directors guides and directs its activities. Producers support these programs and services through levies paid on market hogs and export breeding stock and weanlings. MPC's mission is to foster the sustainability and prosperity of the pork industry for the good of all hog farmers and all Manitobans.
GOVERNMENT FUNDING: "
2026-06-18,-,Chadwick Consulting Ltd,Engineers Geoscientists Manitoba,"Garrett, Tom",-,-,-,933841,Consultant,"Garrett, Tom",Consultant,Active,"LOBBYIST: Garrett, Tom | CLIENT: Engineers Geoscientists Manitoba | FIRM: Chadwick Consulting Ltd | STATUS: Active"
2026-06-18,-,Navitas / International College of Manitoba,Navitas / International College of Manitoba,Darcy Rollins,-,-,-,933180,In-House,"Hudson, Marlo, Hurley, Dan, Jones, Scott, Rollins, Darcy",In-House,Active,"LOBBYING DESCRIPTION: 
ORGANIZATION DESCRIPTION: Navitas Canada Holding Inc. (doing business as Navitas Canada) is a subsidiary of Navitas, a global education provider, and Fraser International College Ltd. It is owned by Marron Group UK Holdings, and oversees the International College of Manitoba.
BUSINESS SUMMARY: Navitas Canada Holdings Inc. (doing business as Navitas Canada) is a part of the Navitas group of companies, a global education provider, and Fraser International College Ltd. Navitas Canada offers first-year university pathway programs to more than 4000 international students, providing wraparound services to support their successful adjustment to life and learning in Canada, at the following public post-secondary institutions: International College of Manitoba (in partnership with the University of Manitoba in Winnipeg, MB); Fraser International College (in partnership with Simon Fraser University in Burnaby, BC); Toronto Metropolitan University International College (in partnership with Toronto Metropolitan University in Toronto, ON); Wilfrid Laurier International College (in partnership with Wilfrid Laurier University in Waterloo, ON); ULethbridge International College Calgary (in partnership with the University of Lethbridge, AB); and Western International College (in partnership with Western University in London, ON). Navitas also offers expertise in international education recruitment data analysis.
GOVERNMENT FUNDING: "
2026-06-18,-,Impact Public Affairs,Canadian Automobile Dealers Association,"Williams, Huw",-,-,-,933518,Consultant,"Williams, Huw",Consultant,Active,"LOBBYIST: Williams, Huw | CLIENT: Canadian Automobile Dealers Association | FIRM: Impact Public Affairs | STATUS: Active"
2026-06-16,-,Amgen Canada Inc.,Amgen Canada Inc.,Ugur Gunaydin,-,-,-,929473,In-House,"Behboodi, Angela, Burke , Natasha, Gunaydin, Ugur, Mackinnon, Erin, Michaels, Nathan J., Snowden, John",In-House,Active,"LOBBYING DESCRIPTION: 
ORGANIZATION DESCRIPTION: Amgen Canada Inc. is a biotechnology company headquartered in Mississauga, Ontario. It is a subsidiary of Amgen Inc.
BUSINESS SUMMARY: Amgen Canada Canada Inc. serves patients throughout Canada by delivering vital medicines to them. The company also contributes to the development of new therapies (and new uses for existing medicines) in partnership with many of Canada’s leading health care, academic, research, government and patient organizations.
GOVERNMENT FUNDING: "
2026-06-16,-,Counsel Public Affairs Inc.,Emergent BioSolutions Canada Inc. (formerly Adapt Pharma Canada Ltd.),"Mason, Jodee",-,-,-,736769,Consultant,"Mason, Jodee",Consultant,Active,"LOBBYIST: Mason, Jodee | CLIENT: Emergent BioSolutions Canada Inc. (formerly Adapt Pharma Canada Ltd.) | FIRM: Counsel Public Affairs Inc. | STATUS: Active"
2026-06-15,-,IQVIA Solutions Canada Inc,IQVIA Solutions Canada Inc,Sylvia Durgerian,-,-,-,932797,In-House,"Laflamme, François, McKay, Robert, Norton, Matthew",In-House,Active,"LOBBYING DESCRIPTION: 
ORGANIZATION DESCRIPTION: IQVIA Solutions Canada Inc. is a wholly-owned, indirect subsidiary of IQVIA Holdings Inc., a multinational and publicly traded company
BUSINESS SUMMARY: IQVIA is a world leader in using data, technology, advanced analytics and human expertise to help customers drive healthcare - and human health - forward. Together with the companies we serve, we are enabling a more modern, more effective and more efficient healthcare system, and creating breakthrough solutions that transform business and patient outcomes.
GOVERNMENT FUNDING: "
2026-06-12,-,Teranet Holdings LP,Teranet Holdings LP,Elgin Farewell,-,-,-,932642,In-House,"Brass, Kerri, Farewell, Elgin, Grewal, Dilprit, Russo, Agostino, Sinha, Scott",In-House,Active,"LOBBYING DESCRIPTION: 
ORGANIZATION DESCRIPTION: Teranet Holdings LP is beneficially owned by OMERS Administration Corporation.
BUSINESS SUMMARY: Teranet Holdings LP is a limited partnership established under the laws
of Ontario and beneficially owned by OMERS Administration Corporation.
Teranet Holdings LP is the owner of Teranet Inc. , the exclusive
provider of electronic property search and registration services in the
Province of Ontario.
GOVERNMENT FUNDING: "
2026-06-12,-,GT and Company Executive Advisors,Diabetes Canada,"Holoiday, Leah",-,-,-,932576,Consultant,"Holoiday, Leah",Consultant,Active,"LOBBYIST: Holoiday, Leah | CLIENT: Diabetes Canada | FIRM: GT and Company Executive Advisors | STATUS: Active"
2026-06-11,-,AstraZeneca Canada Inc.,AstraZeneca Canada Inc.,Gaby Bourbara,-,-,-,919186,In-House,"Badger, Derek, Bourbara, Gaby, Feairs, Jon, McDonald, Heather, Restivo, Gena, Saraza, Noel, Wong, Deb",In-House,Active,"LOBBYING DESCRIPTION: 
ORGANIZATION DESCRIPTION: AstraZeneca Canada Inc is an incorporated business
BUSINESS SUMMARY: AstraZeneca is a global, innovation-driven biopharmaceutical business with a primary focus on the discovery, development and commercialization of prescription medicines for gastrointestinal, cardiovascular, neuroscience, respiratory and inflammation, oncology and infectious disease. AstraZeneca operates in over 100 countries and its innovative medicines are used by millions of patients worldwide. AstraZeneca’s Canadian headquarters are located in Mississauga, Ontario. For more information, please visit the company’s website at www.astrazeneca.ca.
GOVERNMENT FUNDING: "
2026-06-11,-,South Bow Canada Services Ltd.,South Bow Canada Services Ltd.,Bevin Wirzba,-,-,-,893097,In-House,"Anderson, Kristin, Salus, Jill, Wirzba, Bevin",In-House,Active,"LOBBYING DESCRIPTION: 
ORGANIZATION DESCRIPTION: South Bow Canada Services Ltd. is a business corporation.
BUSINESS SUMMARY: South Bow Canada Services Ltd. is a liquids pipeline and infrastructure company connecting Canadian supply to demand markets in North America.
GOVERNMENT FUNDING: "
2026-06-11,-,Organon Canada Inc.,Organon Canada Inc.,Dominic Bégin,-,-,-,918046,In-House,"Bhullar, Raman, Bower, Lee, Bégin, Dominic, Chapel, Jason, Deslongchamps, Isabel, Geneviève, Gauthier, Kolhman, Sandra, Landry, Réjean, MacDonald, Ian, McCarles, Jacqueline, Robitaille, Marc, Samuel, Andrew, Stestko, Jill, Taylor, David, Warwick-Markowski, Elisa, Witwicki, John",In-House,Active,"LOBBYING DESCRIPTION: 
ORGANIZATION DESCRIPTION: Business
BUSINESS SUMMARY: At Organon, we envision a better and healthier every day for every woman as we know that supporting women’s health is foundational to a healthier world. In Canada, we market over 60 medicines across a range of areas including reproductive health, immunology, menopause, dermatology, neurology, and asthma. Based in Montréal, Québec, Organon employs over 180 people across Canada.
GOVERNMENT FUNDING: "
2026-06-11,-,GlaxoSmithKline Inc.,GlaxoSmithKline Inc.,Sridhar Venkatesh,-,-,-,929702,In-House,"Boyd, Ewelina, Choudry , Sumrana, De Franco, Emanuela, Howard, Raegan, Jonathan , Mapletoft, Lock, Ryan, Mhishi, Simbarashe, Pozzobon, Alison, Robertson , Ian, Tennant , Bryan, Turnbull, Patrick, Vaughan, Megan, Venkatesh, Sridhar",In-House,Active,"LOBBYING DESCRIPTION: 
ORGANIZATION DESCRIPTION: GlaxoSmithKline Inc. is a subsidiary to Setfirst Limited (the direct parent) and GlaxoSmithKline plc (the ultimate parent) of 980 Great West Road, Brentford, Middlesex, TW8 9GS, United Kingdom.
BUSINESS SUMMARY: GSK is a science-led global healthcare company. We research and develop a broad range of innovative products in three primary areas: pharmaceuticals, vaccines and consumer Health Care
GOVERNMENT FUNDING: "
2026-06-05,-,StrategyCorp Inc,7-Eleven Canada,"Cerelli, Alex",-,-,-,929605,Consultant,"Cerelli, Alex",Consultant,Active,"LOBBYIST: Cerelli, Alex | CLIENT: 7-Eleven Canada | FIRM: StrategyCorp Inc | STATUS: Active"
2026-06-04,-,Impact Public Affairs,Canadian Dental Hygenist Association,"Aboagye, Nicholas Benjamin",-,-,-,929429,Consultant,"Aboagye, Nicholas Benjamin",Consultant,Active,"LOBBYIST: Aboagye, Nicholas Benjamin | CLIENT: Canadian Dental Hygenist Association | FIRM: Impact Public Affairs | STATUS: Active"
2026-05-26,-,AbbVie Corporation,AbbVie Corporation,Tanusree Misra,-,-,-,919816,In-House,"Corsen, Dana, Just, Harold, Link, David, Malhotra, Reema, Misra, Tanusree, Onyskiw, Jeff, Ravlich, Lynda",In-House,Active,"LOBBYING DESCRIPTION: 
ORGANIZATION DESCRIPTION: AbbVie Corporation is a research-driven biopharmaceutical company.
BUSINESS SUMMARY: AbbVie's mission is to discover and deliver innovative medicines and solutions that solve serious health issues today and address the medical challenges of tomorrow. We strive to have a remarkable impact on people's lives across several key therapeutic areas – immunology, oncology, neuroscience, and eye care – and products and services in our Allergan Aesthetics portfolio. For more information about AbbVie, please visit us at www.abbvie.ca.
GOVERNMENT FUNDING: "
2026-05-26,-,Emergent BioSolutions Canada Inc,Emergent BioSolutions Canada Inc,Paul Williams,-,-,-,929174,In-House,"Frech, Christopher, Louttit, Erica, McLaren, Shawn, Portnik, Linda, Richler, Dvorah, Williams, Paul",In-House,Active,"LOBBYING DESCRIPTION: 
ORGANIZATION DESCRIPTION: Emergent is a pharmaceutical company. It is a corporation.
BUSINESS SUMMARY: Emergent BioSolutions is a global life sciences company whose mission is to protect and enhance life. Through their specialty products and contract development and manufacturing services, they are dedicated to providing solutions that address public health threats. Though social responsibility, they aim to build healthier and safer communities. They aspire to deliver peace of mind to their patients and customers so they can focus on what's most important in their lives. In working together, they envision protecting or enhancing 1 billion lives by 2030.

Lobbying for increased access to nasal naloxone in MB. Lobbying for facility expansion support.
GOVERNMENT FUNDING: "
2026-05-25,-,Manitoba Government and General Employees' Union,Manitoba Government and General Employees' Union,Kyle Ross,-,-,-,929041,In-House,"Ross, Kyle",In-House,Active,"LOBBYING DESCRIPTION: 
ORGANIZATION DESCRIPTION: Union
BUSINESS SUMMARY: The Manitoba Government and General Employees’ Union is a progressive, democratic union committed to improving the working conditions and lives of all of its diverse members and all Manitobans.
GOVERNMENT FUNDING: "
2026-05-22,-,Canadian Association of Direct Relationship Insurers,Canadian Association of Direct Relationship Insurers,Geoff Beechey,-,-,-,928901,In-House,"Allman, Catherine, Beechey, Geoff",In-House,Active,"LOBBYING DESCRIPTION: 
ORGANIZATION DESCRIPTION: CADRI represents insurance companies that offer automobile, home and
commercial insurance products directly to Canadians.
BUSINESS SUMMARY: Canadian Association of Direct Relationship Insurers (CADRI) is a trade
association representing insurance companies that offer automobile, home
and commercial insurance products directly to Canadians. We monitor the
insurance regulatory environment in all provinces and territories and
promote a fair, healthy and competitive insurance market for the benefit
of Canadians. As a voice for our members, we articulate their
perspectives to help inform policy decisions and develop a regulatory
framework that is responsive to the needs of today's insurance consumers.
GOVERNMENT FUNDING: "
2026-05-22,-,GS1 Canada,GS1 Canada,Francois Bouchard,-,-,-,928644,In-House,"Bouchard, Francois, Hawkins, Angela",In-House,Active,"LOBBYING DESCRIPTION: 
ORGANIZATION DESCRIPTION: GS1 Canada is a member of GS1, the world's leading supply chain
standards organization. As a neutral, not-for-profit organization, GS1
Canada enables its more than 24,000 members and organizations of all
sizes from over 25 sectors across Canada to enhance their efficiency and
cost effectiveness by adopting electronic supply chain best practices.
BUSINESS SUMMARY: GS1 Canada is a member of GS1, the world's leading supply chain standards organization. As a neutral, not-for-profit organization, GS1 Canada enables its more than 24,000 members organizations of all sizes, from over 25 sectors across Canada to enhance their efficiency and cost effectiveness by adopting electronic supply chain best practices.
GOVERNMENT FUNDING: "
2026-05-22,-,GW Group,National Coalition Against Contraband Tobacco (NCACT),"Geller, Lorne",-,-,-,928732,Consultant,"Geller, Lorne",Consultant,Active,"LOBBYIST: Geller, Lorne | CLIENT: National Coalition Against Contraband Tobacco (NCACT) | FIRM: GW Group | STATUS: Active"
2026-05-15,-,StrategyCorp Inc.,Consensus Core Technologies Inc.,"Barber, Stephen",-,-,-,850611,Consultant,"Barber, Stephen",Consultant,Active,"LOBBYIST: Barber, Stephen | CLIENT: Consensus Core Technologies Inc. | FIRM: StrategyCorp Inc. | STATUS: Active"
2026-05-15,-,StrategyCorp Inc.,Consensus Core Technologies Inc.,"Cullen, Nathan",-,-,-,850545,Consultant,"Cullen, Nathan",Consultant,Active,"LOBBYIST: Cullen, Nathan | CLIENT: Consensus Core Technologies Inc. | FIRM: StrategyCorp Inc. | STATUS: Active"
2026-05-15,-,Prairie Sky Strategy,Graham Group Ltd.,"Friesen, Cameron",-,-,-,826182,Consultant,"Friesen, Cameron",Consultant,Active,"LOBBYIST: Friesen, Cameron | CLIENT: Graham Group Ltd. | FIRM: Prairie Sky Strategy | STATUS: Active"
2026-05-15,-,Prairie Sky Strategy,Canadian National Railway Company (CN),"Friesen, Cameron Scott",-,-,-,800518,Consultant,"Friesen, Cameron Scott",Consultant,Active,"LOBBYIST: Friesen, Cameron Scott | CLIENT: Canadian National Railway Company (CN) | FIRM: Prairie Sky Strategy | STATUS: Active"
2026-05-15,-,Prairie Sky Strategy,Potentia Renewables Inc.,"Friesen, Cameron Scott",-,-,-,800655,Consultant,"Friesen, Cameron Scott",Consultant,Active,"LOBBYIST: Friesen, Cameron Scott | CLIENT: Potentia Renewables Inc. | FIRM: Prairie Sky Strategy | STATUS: Active"
2026-05-15,-,Foresight Strategic Advisors Inc.,Expedia Group Inc.,"Green, Martin",-,-,-,548114,Consultant,"Green, Martin",Consultant,Active,"LOBBYIST: Green, Martin | CLIENT: Expedia Group Inc. | FIRM: Foresight Strategic Advisors Inc. | STATUS: Active"
2026-05-15,-,StrategyCorp Inc.,Consensus Core Technologies Inc.,"Grove-White, Aidan",-,-,-,893904,Consultant,"Grove-White, Aidan",Consultant,Active,"LOBBYIST: Grove-White, Aidan | CLIENT: Consensus Core Technologies Inc. | FIRM: StrategyCorp Inc. | STATUS: Active"
2026-05-15,-,StrategyCorp Inc.,Consensus Core Technologies Inc.,"Kramer, Trevor",-,-,-,861243,Consultant,"Kramer, Trevor",Consultant,Active,"LOBBYIST: Kramer, Trevor | CLIENT: Consensus Core Technologies Inc. | FIRM: StrategyCorp Inc. | STATUS: Active"
2026-05-15,-,StrategyCorp Inc.,Consensus Core Technologies Inc.,"Woods, Erin",-,-,-,850800,Consultant,"Woods, Erin",Consultant,Active,"LOBBYIST: Woods, Erin | CLIENT: Consensus Core Technologies Inc. | FIRM: StrategyCorp Inc. | STATUS: Active"
2026-05-13,-,Boehringer Ingelheim,Boehringer Ingelheim,Rithesh Mishra,-,-,-,879678,In-House,"Lenahan, Meghan",In-House,Active,"LOBBYING DESCRIPTION: 
ORGANIZATION DESCRIPTION: Pharmaceutical Company with a head office in Burlington Ontario that has interest in human and animal health
BUSINESS SUMMARY: Pharmaceutical Company
GOVERNMENT FUNDING: "
2026-05-12,-,StrategyCorp Inc.,Second Harvest,"Cullen, Nathan",-,-,-,924856,Consultant,"Cullen, Nathan",Consultant,Active,"LOBBYIST: Cullen, Nathan | CLIENT: Second Harvest | FIRM: StrategyCorp Inc. | STATUS: Active"
2026-05-12,-,Alexion,Alexion,Karen Heim,-,-,-,924900,In-House,"Heim, Karen, de Zara, Paul",In-House,Active,"LOBBYING DESCRIPTION: 
ORGANIZATION DESCRIPTION: Alexion Canada is a business
BUSINESS SUMMARY: Alexion is a global, innovation-driven biopharmaceutical business with a primary focus on the discovery and development of prescription medicines for rare disease where there is great unmet need.
GOVERNMENT FUNDING: "
2026-05-12,-,Exiro Nickel,Exiro Nickel,Shastri Ramnath,-,-,-,892582,In-House,"HART, STEPHANIE, KARA, NADIM, RAMNATH, SHASTRI",In-House,Active,"LOBBYING DESCRIPTION: 
ORGANIZATION DESCRIPTION: Exiro Nickel is a mining and mineral exploration company wholly owned by a consortium of investors incluing Canada Growth Fund, Orion Resource Partners, Vale Base Metals and Exiro Minerals
BUSINESS SUMMARY: Mines and explores for nickel in northern Manitoba
GOVERNMENT FUNDING: "
2026-05-11,-,HOFFMANN-LA ROCHE LIMITED,HOFFMANN-LA ROCHE LIMITED,Daniel Edgcumbe,-,-,-,924624,In-House,"DElia, Michele, Edgcumbe, Daniel, Henwood, Robyn, O'Fee, Liam, Routledge, Stephen, Spigelman, Aleina, Vieira, Matheus",In-House,Active,"LOBBYING DESCRIPTION: 
ORGANIZATION DESCRIPTION: Hoffmann-LA Roche Limited is a leading pharmaceutical company that offers integrated healthcare solutions through the combined efforts of its pharmaceutical and diagnostics divisions.
BUSINESS SUMMARY: Hoffmann-La Roche Limited deals with the healthcare system in the prevention, screening, diagnosis, treatment and management of acute and long-term disease and supports leading research, clinical trials and genetic research.
GOVERNMENT FUNDING: "
2026-05-11,-,Association of Home Appliance Manufacturers Canada,Association of Home Appliance Manufacturers Canada,Rémi Moreau,-,-,-,893975,In-House,"Girdharry, Kevin, Mariotti, Kelly, Moreau, Rémi",In-House,Active,"LOBBYING DESCRIPTION: 
ORGANIZATION DESCRIPTION: AHAM Canada is a trade association that represents more than 150 member companies that manufacture 90% of the major, portable and floor care appliances shipped for sale in Canada.
BUSINESS SUMMARY: AHAM Canada was established in 2012 to provide manufacturers with better integration of industry representation in North America. Today, AHAM Canada members support tens of thousands of jobs and produce more than 95% of the household appliances shipped for sale in Canada. The economic impact of these products is nearly $6 billion annually. The home appliance industry, whose products are at the center of life in every home, is essential to consumer lifestyle, health, safety and convenience.
GOVERNMENT FUNDING: "
2026-05-08,-,Counsel Public Affairs Inc,White Ribbon,"Gardner, Matthew",-,-,-,920634,Consultant,"Gardner, Matthew",Consultant,Active,"LOBBYIST: Gardner, Matthew | CLIENT: White Ribbon | FIRM: Counsel Public Affairs Inc | STATUS: Active"
2026-05-07,-,Canadian Consumer Specialty Products Association (CCSPA),Canadian Consumer Specialty Products Association (CCSPA),Shannon Coombs,-,-,-,919358,In-House,"Coombs, Shannon, Erickson, Myles, Golden, Stephanie",In-House,Active,"LOBBYING DESCRIPTION: 
ORGANIZATION DESCRIPTION: CCSPA is a trade association with only one class of membership - full membership.
BUSINESS SUMMARY: CCSPA is a national trade association representing the consumer,
industrial and institutional specialty products industry. Our mission is
to enhance the ability of member companies to conduct business fairly,
ethically and effectively by fostering industry and government
cooperation, advocating for fair and risk- and science-based policies
and laws, seeking ways to promote industry-wide environmental
sustainability and providing a national voice for communications.
GOVERNMENT FUNDING: "
2026-05-07,-,Chadwick Consulting Ltd.,Engineers Geoscientists Manitoba,"Findlater, Katie",-,-,-,922816,Consultant,"Findlater, Katie",Consultant,Active,"LOBBYIST: Findlater, Katie | CLIENT: Engineers Geoscientists Manitoba | FIRM: Chadwick Consulting Ltd. | STATUS: Active"
2026-05-07,-,Counsel Public Affairs Inc.,Teralta Hydrogen Solutions Inc.,"Mason, Jodee",-,-,-,739860,Consultant,"Mason, Jodee",Consultant,Active,"LOBBYIST: Mason, Jodee | CLIENT: Teralta Hydrogen Solutions Inc. | FIRM: Counsel Public Affairs Inc. | STATUS: Active"
2026-05-06,-,StrategyCorp Inc.,Consensus Core Technologies Inc.,"Rockingham, Jamie",-,-,-,893464,Consultant,"Rockingham, Jamie",Consultant,Active,"LOBBYIST: Rockingham, Jamie | CLIENT: Consensus Core Technologies Inc. | FIRM: StrategyCorp Inc. | STATUS: Active"
2026-05-04,-,Janssen Inc.,Janssen Inc.,Laetitia Decroix Guilloux,-,-,-,920070,In-House,"Bessant, Jennifer, Da Re, Monica, Decroix Guilloux , Laetitia, Gilchrist, Keith, Partridge , Darren, Shi, Kun, Tang, Michelle",In-House,Active,"LOBBYING DESCRIPTION: 
ORGANIZATION DESCRIPTION: Janssen Inc. is a business corporation that is a subsidiary of US based Johnson & Johnson.
BUSINESS SUMMARY: Janssen Inc. is a subsidiary of US based Johnson & Johnson and is a bio pharmaceutical company focused on the sales, marketing and distribution of innovative medicines. Janssen Inc. has no subsidiary companies, although another entity, Johnson & Johnson (Canada) Inc., which is also registered to lobby in Manitoba, may have a direct interest in its lobbying.
GOVERNMENT FUNDING: "
